A1: ADX | B1: CCI | C1: CLOSE | D1: calc | E1: gap | F1: DATEONE | G1: HIGH | H1: LINEARREG | I1: LINEARREG10 | J1: LINEARREGANGLE | K1: LINEARREGINTERCEPT | L1: LINEARREGSLOPE | M1: LINEARREGSLOPE10 | N1: LOCALHIGH | O1: LOCALLOW | P1: LOW | Q1: LRSDELTA | R1: MOMENTUM | S1: OPEN | T1: PP | U1: R1 | V1: R1BREAK | W1: R2 | X1: R2BREAK | Y1: RSI | Z1: S1 | AA1: S1BREAK | AB1: S2 | AC1: S2BREAK | AD1: SYMBOL | AE1: VOLUME
A2: 0 | B2: 0 | C2: 178.41 | F2: 40546 | G2: 180.87 | H2: 0 | I2: 0 | J2: 0 | K2: 0 | L2: 0 | M2: 0 | N2: FALSE | O2: FALSE | P2: 173.5 | Q2: 0 | R2: 0 | S2: 175 | T2: 177.593333333 | U2: 181.686666667 | V2: FALSE | W2: 184.96333333300001 | X2: FALSE | Y2: 0 | Z2: 174.31666666699999 | AA2: FALSE | AB2: 170.223333333 | AC2: FALSE | AD2: nflx | AE2: 5708516
A3: 0 | B3: 0 | C3: 181.37 | F3: 40547 | G3: 184.9 | H3: 0 | I3: 0 | J3: 0 | K3: 0 | L3: 0 | M3: 0 | N3: TRUE | O3: FALSE | P3: 178.29 | Q3: 0 | R3: 0 | S3: 181.35 | T3: 181.52 | U3: 184.75 | V3: FALSE | W3: 188.13 | X3: FALSE | Y3: 0 | Z3: 178.14 | AA3: FALSE | AB3: 174.91 | AC3: FALSE | AD3: nflx | AE3: 6297278
A4: 0 | B4: 0 | C4: 179.73 | F4: 40548 | G4: 182.79 | H4: 0 | I4: 0 | J4: 0 | K4: 0 | L4: 0 | M4: 0 | N4: FALSE | O4: FALSE | P4: 178.71 | Q4: 0 | R4: 0 | S4: 181.15 | T4: 180.41 | U4: 182.11 | V4: FALSE | W4: 184.49 | X4: FALSE | Y4: 0 | Z4: 178.03 | AA4: FALSE | AB4: 176.33 | AC4: FALSE | AD4: nflx | AE4: 4550394
A5: 0 | B5: 0 | C5: 177.99 | F5: 40549 | G5: 179.69 | H5: 0 | I5: 0 | J5: 0 | K5: 0 | L5: 0 | M5: 0 | N5: FALSE | O5: TRUE | P5: 175.65 | Q5: 0 | R5: 0 | S5: 176.18 | T5: 177.776666667 | U5: 179.90333333300001 | V5: FALSE | W5: 181.81666666699999 | X5: FALSE | Y5: 0 | Z5: 175.86333333300001 | AA5: TRUE | AB5: 173.73666666700001 | AC5: TRUE | AD5: nflx | AE5: 4573536
A6: 0 | B6: 0 | C6: 179.3 | F6: 40550 | G6: 180.55 | H6: 0 | I6: 0 | J6: 0 | K6: 0 | L6: 0 | M6: 0 | N6: FALSE | O6: FALSE | P6: 176.38 | Q6: 0 | R6: 0 | S6: 178.67 | T6: 178.74333333300001 | U6: 181.10666666700001 | V6: TRUE | W6: 182.913333333 | X6: FALSE | Y6: 0 | Z6: 176.936666667 | AA6: FALSE | AB6: 174.57333333299999 | AC6: FALSE | AD6: nflx | AE6: 3165228
A7: 0 | B7: 0 | C7: 187.88 | D7: =C2-C7 -> -9.47 | E7: -9.47 | F7: 40553 | G7: 187.95 | H7: 0 | I7: 0 | J7: 0 | K7: 0 | L7: 0 | M7: 0 | N7: FALSE | O7: FALSE | P7: 179.18 | Q7: 0 | R7: 0 | S7: 179.7 | T7: 185.003333333 | U7: 190.82666666700001 | V7: TRUE | W7: 193.77333333300001 | X7: TRUE | Y7: 0 | Z7: 182.056666667 | AA7: FALSE | AB7: 176.23333333299999 | AC7: FALSE | AD7: nflx | AE7: 6245967
A8: 0 | B8: 0 | C8: 186.65 | D8: =C3-C8 -> -5.28 | E8: -5.28 | F8: 40554 | G8: 191.3 | H8: 0 | I8: 0 | J8: 0 | K8: 0 | L8: 0 | M8: 0 | N8: TRUE | O8: FALSE | P8: 185.77 | Q8: 0 | R8: 0 | S8: 189.42 | T8: 187.906666667 | U8: 190.04333333299999 | V8: TRUE | W8: 193.436666667 | X8: FALSE | Y8: 0 | Z8: 184.51333333299999 | AA8: FALSE | AB8: 182.37666666699999 | AC8: FALSE | AD8: nflx | AE8: 4649749
A9: 0 | B9: 0 | C9: 188.9 | D9: =C4-C9 -> -9.1700000000000159 | E9: -9.1700000000000159 | F9: 40555 | G9: 189 | H9: 0 | I9: 0 | J9: 0 | K9: 0 | L9: 0 | M9: 0 | N9: FALSE | O9: TRUE | P9: 184.75 | Q9: 0 | R9: 0 | S9: 188.01 | T9: 187.55 | U9: 190.35 | V9: FALSE | W9: 191.8 | X9: FALSE | Y9: 0 | Z9: 186.1 | AA9: FALSE | AB9: 183.3 | AC9: FALSE | AD9: nflx | AE9: 3016079
A10: 0 | B10: 0 | C10: 191.49 | D10: =C5-C10 -> -13.5 | E10: -13.50 | F10: 40556 | G10: 192.35 | H10: 0 | I10: 0 | J10: 0 | K10: 0 | L10: 0 | M10: 0 | N10: FALSE | O10: FALSE | P10: 187 | Q10: 0 | R10: 0 | S10: 188.44 | T10: 190.28 | U10: 193.56 | V10: TRUE | W10: 195.63 | X10: TRUE | Y10: 0 | Z10: 188.21 | AA10: FALSE | AB10: 184.93 | AC10: FALSE | AD10: nflx | AE10: 4280536
A11: 0 | B11: 0 | C11: 193.68 | D11: =C6-C11 -> -14.38 | E11: -14.38 | F11: 40561 | G11: 194.84 | H11: 0 | I11: 192.413090909 | J11: 0 | K11: 0 | L11: 0 | M11: 1.7495757575799999 | N11: TRUE | O11: FALSE | P11: 189.57 | Q11: 0 | R11: 0 | S11: 191.47 | T11: 192.69666666699999 | U11: 195.82333333299999 | V11: TRUE | W11: 197.966666667 | X11: FALSE | Y11: 0 | Z11: 190.55333333300001 | AA11: FALSE | AB11: 187.42666666700001 | AC11: FALSE | AD11: nflx | AE11: 2655754
A12: 0 | B12: 0 | C12: 190.87 | D12: =C7-C12 -> -2.9900000000000091 | E12: -2.9900000000000091 | F12: 40562 | G12: 193.85 | H12: 0 | I12: 193.37381818200001 | J12: 0 | K12: 0 | L12: 0 | M12: 1.6861818181799999 | N12: FALSE | O12: FALSE | P12: 189.02 | Q12: 0 | R12: 0 | S12: 192.81 | T12: 191.246666667 | U12: 193.473333333 | V12: FALSE | W12: 196.07666666700001 | X12: FALSE | Y12: 0 | Z12: 188.64333333299999 | AA12: TRUE | AB12: 186.41666666699999 | AC12: FALSE | AD12: nflx | AE12: 3111306
A13: 0 | B13: 0 | C13: 185 | D13: =C8-C13 -> 1.6500000000000057 | E13: 1.6500000000000057 | F13: 40563 | G13: 188.23 | H13: 0 | I13: 192.21909090899999 | J13: 0 | K13: 0 | L13: 0 | M13: 1.3489090909100001 | N13: FALSE | O13: TRUE | P13: 181.3 | Q13: 0 | R13: 0 | S13: 186.82 | T13: 184.843333333 | U13: 188.38666666699999 | V13: FALSE | W13: 191.77333333300001 | X13: FALSE | Y13: 0 | Z13: 181.45666666700001 | AA13: TRUE | AB13: 177.913333333 | AC13: TRUE | AD13: nflx | AE13: 5464225
A14: 0 | B14: 0 | C14: 182.09 | D14: =C9-C14 -> 6.81 | E14: 6.81 | F14: 40564 | G14: 185.58 | H14: 0 | I14: 189.53309090900001 | J14: 0 | K14: 0 | L14: 0 | M14: 0.69957575757599999 | N14: FALSE | O14: FALSE | P14: 181.69 | Q14: 0 | R14: 0 | S14: 184.86 | T14: 183.12 | U14: 184.55 | V14: FALSE | W14: 187.01 | X14: FALSE | Y14: 0 | Z14: 180.66 | AA14: FALSE | AB14: 179.23 | AC14: FALSE | AD14: nflx | AE14: 3559999
A15: 0 | B15: -44.618055555600002 | C15: 183.96 | D15: =C10-C15 -> 7.53 | E15: 7.53 | F15: 40567 | G15: 184.42 | H15: 189.13200000000001 | I15: 187.01636363599999 | J15: 33.629581109299998 | K15: 180.485142857 | L15: 0.66514285714300003 | M15: 7.6363636363499998E-3 | N15: FALSE | O15: TRUE | P15: 176.07 | Q15: -0.66514285714300003 | R15: 0 | S15: 179.99 | T15: 181.48333333299999 | U15: 186.89666666700001 | V15: FALSE | W15: 189.83333333300001 | X15: FALSE | Y15: 0 | Z15: 178.54666666700001 | AA15: TRUE | AB15: 173.133333333 | AC15: TRUE | AD15: nflx | AE15: 3853913
A16: 0 | B16: 3.9463777430899998 | C16: 186.74 | D16: =C11-C16 -> 6.94 | E16: 6.94 | F16: 40568 | G16: 186.85 | H16: 188.71457142899999 | I16: 185.39636363599999 | J16: 26.9935935566 | K16: 182.092571429 | L16: 0.50938461538500002 | M16: -0.51769696969699996 | N16: FALSE | O16: FALSE | P16: 181.56 | Q16: 0.15575824175799999 | R16: 8.33 | S16: 182.99 | T16: 185.05 | U16: 188.54 | V16: FALSE | W16: 190.34 | X16: FALSE | Y16: 60.225877731399997 | Z16: 183.25 | AA16: FALSE | AB16: 179.76 | AC16: FALSE | AD16: nflx | AE16: 3072870
A17: 0 | B17: -16.464535097399999 | C17: 183.03 | D17: =C12-C17 -> 7.84 | E17: 7.84 | F17: 40569 | G17: 187.59 | H17: 187.52799999999999 | I17: 183.80490909100001 | J17: 17.1498809546 | K17: 183.51628571399999 | L17: 0.308593406593 | M17: -0.76357575757600005 | N17: FALSE | O17: FALSE | P17: 181.83 | Q17: 0.20079120879199999 | R17: 1.66 | S17: 187.4 | T17: 184.15 | U17: 186.47 | V17: FALSE | W17: 189.91 | X17: FALSE | Y17: 54.845811189700001 | Z17: 180.71 | AA17: TRUE | AB17: 178.39 | AC17: FALSE | AD17: nflx | AE17: 8548759
A18: 0 | B18: 282.52465328300002 | C18: 210.87 | D18: =C13-C18 -> -25.87 | E18: -25.87 | F18: 40570 | G18: 211.79 | H18: 193.21857142900001 | I18: 191.84945454499999 | J18: 40.092957232300002 | K18: 182.274285714 | L18: 0.84186813186800002 | M18: 0.48587878787900002 | N18: FALSE | O18: FALSE | P18: 204.58 | Q18: -0.53327472527499997 | R18: 31.14 | S18: 207.15 | T18: 209.08 | U18: 213.58 | V18: TRUE | W18: 216.29 | X18: TRUE | Y18: 73.776721579300002 | Z18: 206.37 | AA18: FALSE | AB18: 201.87 | AC18: FALSE | AD18: nflx | AE18: 18434505
A19: 0 | B19: 236.732897767 | C19: 217.98 | D19: =#REF!-C19 -> #REF! | E19: -35.89 | F19: 40571 | G19: 218 | H19: 199.599142857 | I19: 201.47909090900001 | J19: 54.151120602799999 | K19: 181.60657142900001 | L19: 1.38404395604 | M19: 1.9795757575799999 | N19: TRUE | O19: FALSE | P19: 208.65 | Q19: -0.54217582417200005 | R19: 39.99 | S19: 211.69 | T19: 214.87666666699999 | U19: 221.10333333299999 | V19: TRUE | W19: 224.22666666699999 | X19: TRUE | Y19: 76.487854266599996 | Z19: 211.753333333 | AA19: FALSE | AB19: 205.526666667 | AC19: FALSE | AD19: nflx | AE19: 8976254
A20: 0 | B20: 162.612671963 | C20: 214.08 | D20: =C15-C20 -> -30.12 | E20: -30.12 | F20: 40574 | G20: 216.51 | H20: 204.021428571 | I20: 208.69327272699999 | J20: 59.2701925772 | K20: 182.15285714300001 | L20: 1.6821978021999999 | M20: 3.0807272727299999 | N20: FALSE | O20: FALSE | P20: 210.26 | Q20: -0.29815384616000001 | R20: 34.78 | S20: 213.1 | T20: 213.616666667 | U20: 216.973333333 | V20: FALSE | W20: 219.866666667 | X20: FALSE | Y20: 72.085438821799997 | Z20: 210.723333333 | AA20: TRUE | AB20: 207.366666667 | AC20: FALSE | AD20: nflx | AE20: 5866203
A21: 0 | B21: 123.18519609000001 | C21: 212.9 | D21: =C16-C21 -> -26.16 | E21: -26.16 | F21: 40575 | G21: 216.78 | H21: 208.37228571399999 | I21: 214.70563636399999 | J21: 64.286728024400006 | K21: 181.37628571400001 | L21: 2.0766153846200002 | M21: 3.9896969697000002 | N21: TRUE | O21: FALSE | P21: 212.05 | Q21: -0.39441758242000002 | R21: 25.02 | S21: 214.63 | T21: 213.91 | U21: 215.77 | V21: FALSE | W21: 218.64 | X21: FALSE | Y21: 70.758414981000001 | Z21: 211.04 | AA21: FALSE | AB21: 209.18 | AC21: FALSE | AD21: nflx | AE21: 4103252
A22: 0 | B22: 85.179729130799998 | C22: 211.26 | D22: =C17-C22 -> -28.23 | E22: -28.23 | F22: 40576 | G22: 213.67 | H22: 211.41085714299999 | I22: 218.54109090899999 | J22: 66.259062448999998 | K22: 181.85342857099999 | L22: 2.2736483516499999 | M22: 4.3889090909100004 | N22: FALSE | O22: TRUE | P22: 208.25 | Q22: -0.19703296703000001 | R22: 24.61 | S22: 208.73 | T22: 211.06 | U22: 213.87 | V22: FALSE | W22: 216.48 | X22: FALSE | Y22: 68.861048032599996 | Z22: 208.45 | AA22: TRUE | AB22: 205.64 | AC22: TRUE | AD22: nflx | AE22: 4765603
A23: 0 | B23: 73.375935291100006 | C23: 211.49 | D23: =C18-C23 -> -0.62000000000000455 | E23: -0.62000000000000455 | F23: 40577 | G23: 213.32 | H23: 214.126857143 | I23: 220.169818182 | J23: 67.741183550900004 | K23: 182.36457142899999 | L23: 2.4432527472499999 | M23: 4.1621818181799997 | N23: FALSE | O23: FALSE | P23: 209.72 | Q23: -0.16960439560000001 | R23: 22.59 | S23: 211.05 | T23: 211.51 | U23: 213.3 | V23: FALSE | W23: 215.11 | X23: FALSE | Y23: 68.986648313399996 | Z23: 209.7 | AA23: FALSE | AB23: 207.91 | AC23: FALSE | AD23: nflx | AE23: 3036466
A24: 0 | B24: 89.3392070485 | C24: 220.07 | D24: =C19-C24 -> -2.09 | E24: -2.09 | F24: 40578 | G24: 221 | H24: 218.773714286 | I24: 222.73563636399999 | J24: 70.627990645400004 | K24: 181.800571429 | L24: 2.84408791209 | M24: 3.8883636363599998 | N24: FALSE | O24: FALSE | P24: 212.04 | Q24: -0.40083516483999998 | R24: 28.58 | S24: 212.96 | T24: 217.70333333299999 | U24: 223.366666667 | V24: TRUE | W24: 226.663333333 | X24: TRUE | Y24: 73.311360323299994 | Z24: 214.406666667 | AA24: FALSE | AB24: 208.74333333300001 | AC24: FALSE | AD24: nflx | AE24: 6324284
A25: 0 | B25: 84.905304121300006 | C25: 218.02 | D25: =C20-C25 -> -3.94 | E25: -3.94 | F25: 40581 | G25: 222.81 | H25: 222.38971428599999 | I25: 222.89563636400001 | J25: 72.297399052000003 | K25: 181.66171428600001 | L25: 3.13292307692 | M25: 3.1670303030300002 | N25: TRUE | O25: FALSE | P25: 217.86 | Q25: -0.28883516482999999 | R25: 24.34 | S25: 222.79 | T25: 219.563333333 | U25: 221.26666666700001 | V25: FALSE | W25: 224.51333333299999 | X25: FALSE | Y25: 70.772017587600004 | Z25: 216.31666666699999 | AA25: FALSE | AB25: 214.61333333300001 | AC25: FALSE | AD25: nflx | AE25: 3634065
A26: 0 | B26: 66.493178809599996 | C26: 217.62 | D26: =C21-C26 -> -4.72 | E26: -4.72 | F26: 40582 | G26: 218.39 | H26: 224.80600000000001 | I26: 221.61563636400001 | J26: 72.700369537499995 | K26: 183.06685714299999 | L26: 3.2107032967000002 | M26: 2.1963636363600001 | N26: FALSE | O26: TRUE | P26: 216.14 | Q26: -7.7780219780000007E-2 | R26: 26.75 | S26: 218.25 | T26: 217.383333333 | U26: 218.62666666699999 | V26: FALSE | W26: 219.633333333 | X26: FALSE | Y26: 70.260626826999996 | Z26: 216.37666666699999 | AA26: TRUE | AB26: 215.133333333 | AC26: FALSE | AD26: nflx | AE26: 2483276
A27: 0 | B27: 78.763825840600006 | C27: 222.29 | D27: =C22-C27 -> -11.03 | E27: -11.03 | F27: 40583 | G27: 223.98 | H27: 226.82028571399999 | I27: 219.522545455 | J27: 72.179512502600005 | K27: 186.379714286 | L27: 3.1108131868100002 | M27: 0.858787878788 | N27: FALSE | O27: FALSE | P27: 217.29 | Q27: 9.9890109889999995E-2 | R27: 37.29 | S27: 217.29 | T27: 221.186666667 | U27: 225.08333333300001 | V27: TRUE | W27: 227.87666666699999 | X27: TRUE | Y27: 72.737472721000003 | Z27: 218.39333333299999 | AA27: FALSE | AB27: 214.496666667 | AC27: FALSE | AD27: nflx | AE27: 4141978
A28: 0 | B28: 86.368802751299995 | C28: 223.2 | D28: =C23-C28 -> -11.71 | E28: -11.71 | F28: 40584 | G28: 225 | H28: 227.587428571 | I28: 221.17036363599999 | J28: 70.196515481199995 | K28: 191.485428571 | L28: 2.7770769230800001 | M28: 0.95096969697 | N28: FALSE | O28: FALSE | P28: 220.31 | Q28: 0.33373626372999998 | R28: 41.11 | S28: 220.97 | T28: 222.836666667 | U28: 225.36333333300001 | V28: FALSE | W28: 227.526666667 | X28: FALSE | Y28: 73.205765779499998 | Z28: 220.67333333299999 | AA28: FALSE | AB28: 218.14666666700001 | AC28: FALSE | AD28: nflx | AE28: 3114682
A29: 47.665043519000001 | B29: 129.29372101199999 | C29: 231.07 | D29: =C24-C29 -> -11 | E29: -11.00 | F29: 40585 | G29: 231.6 | H29: 229.47085714299999 | I29: 226.286363636 | J29: 68.580482710499993 | K29: 196.33199999999999 | L29: 2.5491428571400001 | M29: 1.79696969697 | N29: FALSE | O29: FALSE | P29: 223.92 | Q29: 0.22793406594000001 | R29: 47.11 | S29: 224.24 | T29: 228.86333333300001 | U29: 233.806666667 | V29: TRUE | W29: 236.54333333299999 | X29: TRUE | Y29: 76.901152854399996 | Z29: 226.12666666699999 | AA29: FALSE | AB29: 221.18333333300001 | AC29: FALSE | AD29: nflx | AE29: 6620314
A30: 49.327282182899999 | B30: 222.79938006500001 | C30: 247.55 | D30: =C25-C30 -> -29.53 | E30: -29.53 | F30: 40588 | G30: 247.55 | H30: 234.64314285699999 | I30: 235.601454545 | J30: 69.5141562548 | K30: 199.84685714299999 | L30: 2.6766373626400002 | M30: 3.1232121212099999 | N30: TRUE | O30: FALSE | P30: 234.57 | Q30: -0.12749450549999999 | R30: 60.81 | S30: 235.68 | T30: 243.223333333 | U30: 251.87666666699999 | V30: TRUE | W30: 256.20333333299999 | X30: TRUE | Y30: 82.380986097700003 | Z30: 238.89666666700001 | AA30: FALSE | AB30: 230.24333333300001 | AC30: FALSE | AD30: nflx | AE30: 11217645
A31: 50.870789513600002 | B31: 175.425003707 | C31: 240.79 | D31: =C26-C31 -> -23.17 | E31: -23.17 | F31: 40589 | G31: 244.65 | H31: 235.809714286 | I31: 240.51963636400001 | J31: 65.764170446899996 | K31: 206.93171428599999 | L31: 2.2213846153799999 | M31: 3.59636363636 | N31: FALSE | O31: FALSE | P31: 238.01 | Q31: 0.45525274725999998 | R31: 57.76 | S31: 243.49 | T31: 241.15 | U31: 244.29 | V31: FALSE | W31: 247.79 | X31: FALSE | Y31: 74.566588836099996 | Z31: 237.65 | AA31: TRUE | AB31: 234.51 | AC31: FALSE | AD31: nflx | AE31: 6867682
A32: 51.945080029700001 | B32: 126.878844746 | C32: 237.72 | D32: =C27-C32 -> -15.43 | E32: -15.43 | F32: 40590 | G32: 244.89 | H32: 238.51371428600001 | I32: 242.52799999999999 | J32: 66.881133702400007 | K32: 208.063428571 | L32: 2.3423296703299998 | M32: 3.4546666666700001 | N32: TRUE | O32: FALSE | P32: 236.34 | Q32: -0.12094505495000001 | R32: 26.85 | S32: 242.71 | T32: 239.65 | U32: 242.96 | V32: TRUE | W32: 248.2 | X32: FALSE | Y32: 71.260651254199999 | Z32: 234.41 | AA32: TRUE | AB32: 231.1 | AC32: FALSE | AD32: nflx | AE32: 6514737
A33: 52.451593779600003 | B33: 87.610639814199999 | C33: 235.63 | D33: =C28-C33 -> -12.43 | E33: -12.43 | F33: 40591 | G33: 241.8 | H33: 240.92885714299999 | I33: 242.417090909 | J33: 68.355050896899996 | K33: 208.16971428599999 | L33: 2.5199340659299998 | M33: 2.8935757575799999 | N33: FALSE | O33: FALSE | P33: 234.06 | Q33: -0.17760439559999999 | R33: 17.65 | S33: 235.87 | T33: 237.163333333 | U33: 240.26666666700001 | V33: FALSE | W33: 244.90333333300001 | X33: FALSE | Y33: 69.017281718999996 | Z33: 232.526666667 | AA33: TRUE | AB33: 229.42333333299999 | AC33: FALSE | AD33: nflx | AE33: 5642550
A34: 50.568721216299998 | B34: -7.3515574253200002 | C34: 221.6 | D34: =C29-C34 -> 9.47 | E34: 9.47 | F34: 40596 | G34: 229.41 | H34: 238.674857143 | I34: 237.858727273 | J34: 64.435963946800001 | K34: 211.49799999999999 | L34: 2.0905274725299998 | M34: 1.8466060606100001 | N34: FALSE | O34: FALSE | P34: 220.71 | Q34: 0.42940659339999998 | R34: 7.52 | S34: 225.37 | T34: 223.906666667 | U34: 227.10333333299999 | V34: FALSE | W34: 232.60666666700001 | X34: FALSE | Y34: 56.221915097900002 | Z34: 218.40333333300001 | AA34: TRUE | AB34: 215.20666666700001 | AC34: TRUE | AD34: nflx | AE34: 7919406
A35: 46.984566675000003 | B35: -93.484322853899997 | C35: 211.2 | D35: =C30-C35 -> 36.35 | E35: 36.35 | F35: 40597 | G35: 217.9 | H35: 233.36314285700001 | I35: 229.21418181799999 | J35: 52.260822524200002 | K35: 216.56685714299999 | L35: 1.29202197802 | M35: 7.7151515151499997E-2 | N35: FALSE | O35: TRUE | P35: 205.39 | Q35: 0.79850549450999997 | R35: -1.7 | S35: 215.55 | T35: 211.496666667 | U35: 217.60333333299999 | V35: FALSE | W35: 224.00666666699999 | X35: FALSE | Y35: 48.9738878446 | Z35: 205.093333333 | AA35: TRUE | AB35: 198.98666666700001 | AC35: TRUE | AD35: nflx | AE35: 9856130
A36: 43.656423172300002 | B36: -78.881544510599994 | C36: 215.18 | D36: =C31-C36 -> 25.61 | E36: 25.61 | F36: 40598 | G36: 216.39 | H36: 228.889142857 | I36: 222.236545455 | J36: 29.2766188658 | K36: 221.60085714300001 | L36: 0.56063736263700004 | M36: -1.41921212121 | N36: FALSE | O36: FALSE | P36: 210.28 | Q36: 0.73138461538300004 | R36: 3.92 | S36: 212.5 | T36: 213.95 | U36: 217.62 | V36: FALSE | W36: 220.06 | X36: FALSE | Y36: 51.548184844399998 | Z36: 211.51 | AA36: FALSE | AB36: 207.84 | AC36: FALSE | AD36: nflx | AE36: 4519890
A37: 40.684752621800001 | B37: -83.0344351854 | C37: 212.44 | D37: =C32-C37 -> 25.28 | E37: 25.28 | F37: 40599 | G37: 217.49 | H37: 223.63142857099999 | I37: 215.37945454499999 | J37: -14.5034227289 | K37: 226.994285714 | L37: -0.25868131868100003 | M37: -2.72412121212 | N37: TRUE | O37: FALSE | P37: 211.05 | Q37: 0.81931868131800001 | R37: 0.95 | S37: 214.63 | T37: 213.66 | U37: 216.27 | V37: FALSE | W37: 220.1 | X37: FALSE | Y37: 49.6895939992 | Z37: 209.83 | AA37: TRUE | AB37: 207.22 | AC37: FALSE | AD37: nflx | AE37: 4214657
A38: 38.479423131899999 | B38: -112.97401549999999 | C38: 206.67 | D38: =C33-C38 -> 28.96 | E38: 28.96 | F38: 40602 | G38: 214.31 | H38: 218.08857142900001 | I38: 207.24836363599999 | J38: -43.9551105858 | K38: 230.622857143 | L38: -0.96417582417600001 | M38: -4.1636969697000001 | N38: FALSE | O38: FALSE | P38: 203 | Q38: 0.70549450549500003 | R38: -13.4 | S38: 213.85 | T38: 207.99333333300001 | U38: 212.98666666700001 | V38: FALSE | W38: 219.30333333300001 | X38: FALSE | Y38: 45.9337123683 | Z38: 201.67666666700001 | AA38: TRUE | AB38: 196.68333333300001 | AC38: TRUE | AD38: nflx | AE38: 5792190
A39: 36.649408103799999 | B39: -120.314566692 | C39: 204.63 | D39: =C34-C39 -> 16.97 | E39: 16.97 | F39: 40603 | G39: 207.46 | H39: 212.111142857 | I39: 200.88818181799999 | J39: -60.065567314200003 | K39: 234.687428571 | L39: -1.73663736264 | M39: -4.98951515152 | N39: FALSE | O39: TRUE | P39: 200.75 | Q39: 0.77246153846400001 | R39: -13.39 | S39: 206.2 | T39: 204.28 | U39: 207.81 | V39: FALSE | W39: 210.99 | X39: FALSE | Y39: 44.648737397799998 | Z39: 201.1 | AA39: TRUE | AB39: 197.57 | AC39: FALSE | AD39: nflx | AE39: 5695936
A40: 34.944894084200001 | B40: -104.735670562 | C40: 204.23 | D40: =C35-C40 -> 6.97 | E40: 6.97 | F40: 40604 | G40: 207.5 | H40: 206.35628571399999 | I40: 199.12799999999999 | J40: -67.998152905699996 | K40: 238.52942857100001 | L40: -2.4748571428599999 | M40: -4.4180000000000001 | N40: TRUE | O40: FALSE | P40: 201.75 | Q40: 0.73821978022000001 | R40: -13.39 | S40: 205 | T40: 204.49333333300001 | U40: 207.23666666700001 | V40: FALSE | W40: 210.24333333300001 | X40: FALSE | Y40: 44.3865396733 | Z40: 201.48666666700001 | AA40: FALSE | AB40: 198.74333333300001 | AC40: FALSE | AD40: nflx | AE40: 4719500
A41: 33.510396448500003 | B41: -92.423473384100006 | C41: 203.37 | D41: =C36-C41 -> 11.81 | E41: 11.81 | F41: 40605 | G41: 207.09 | H41: 201.43 | I41: 198.08163636399999 | J41: -71.706293568299998 | K41: 240.752857143 | L41: -3.0248351648399998 | M41: -3.81896969697 | N41: FALSE | O41: TRUE | P41: 200.35 | Q41: 0.54997802198000001 | R41: -18.92 | S41: 206.5 | T41: 203.60333333299999 | U41: 206.85666666700001 | V41: FALSE | W41: 210.343333333 | X41: FALSE | Y41: 43.791112219699997 | Z41: 200.116666667 | AA41: TRUE | AB41: 196.86333333300001 | AC41: FALSE | AD41: nflx | AE41: 5042203
A42: 31.593838671499999 | B42: -57.953185263999998 | C42: 210.72 | D42: =C37-C42 -> 1.72 | E42: 1.72 | F42: 40606 | G42: 211.28 | H42: 199.06428571399999 | I42: 201.001454545 | J42: -72.905435342700002 | K42: 241.33571428600001 | L42: -3.2516483516500001 | M42: -2.5701212121200001 | N42: FALSE | O42: FALSE | P42: 203.75 | Q42: 0.22681318681000001 | R42: -12.48 | S42: 203.75 | T42: 208.58333333300001 | U42: 213.41666666699999 | V42: TRUE | W42: 216.11333333300001 | X42: TRUE | Y42: 49.968370811600003 | Z42: 205.88666666699999 | AA42: FALSE | AB42: 201.05333333300001 | AC42: FALSE | AD42: nflx | AE42: 6311186
A43: 29.341699758200001 | B43: -50.314609391799998 | C43: 207.4 | D43: =C38-C43 -> -0.73000000000001819 | E43: -0.73000000000001819 | F43: 40609 | G43: 214.89 | H43: 197.32571428599999 | I43: 203.829090909 | J43: -72.941810461599999 | K43: 239.692857143 | L43: -3.2590109890100001 | M43: -1.3144242424200001 | N43: TRUE | O43: FALSE | P43: 204.25 | Q43: 7.3626373600000003E-3 | R43: -23.67 | S43: 214.73 | T43: 208.84666666699999 | U43: 213.443333333 | V43: TRUE | W43: 219.48666666700001 | X43: FALSE | Y43: 47.432637962100003 | Z43: 202.80333333300001 | AA43: TRUE | AB43: 198.20666666700001 | AC43: FALSE | AD43: nflx | AE43: 5305503
A44: 28.354349682300001 | B44: -105.336931175 | C44: 195.45 | D44: =C39-C44 -> 9.1800000000000068 | E44: 9.1800000000000068 | F44: 40610 | G44: 202.25 | H44: 195.544857143 | I44: 201.262363636 | J44: -71.335794349899999 | K44: 234.03085714299999 | L44: -2.9604615384600002 | M44: -1.3036969697 | N44: FALSE | O44: FALSE | P44: 194.36 | Q44: -0.29854945054999998 | R44: -52.1 | S44: 200.2 | T44: 197.35333333299999 | U44: 200.34666666699999 | V44: FALSE | W44: 205.24333333300001 | X44: FALSE | Y44: 39.635921038200003 | Z44: 192.45666666700001 | AA44: TRUE | AB44: 189.46333333300001 | AC44: TRUE | AD44: nflx | AE44: 9714233
A45: 27.749728215000001 | B45: -121.081497454 | C45: 192.99 | D45: =C40-C45 -> 11.24 | E45: 11.24 | F45: 40611 | G45: 199.44 | H45: 193.654285714 | I45: 197.19218181799999 | J45: -69.855349660300007 | K45: 229.092857143 | L45: -2.7260439560399998 | M45: -1.8035151515200001 | N45: FALSE | O45: FALSE | P45: 191.12 | Q45: -0.23441758241999999 | R45: -47.8 | S45: 195.29 | T45: 194.51666666700001 | U45: 197.913333333 | V45: FALSE | W45: 202.836666667 | X45: FALSE | Y45: 38.242344325099999 | Z45: 189.593333333 | AA45: TRUE | AB45: 186.19666666699999 | AC45: FALSE | AD45: nflx | AE45: 7180931
A46: 26.598656285099999 | B46: -98.575349703399993 | C46: 200.02 | D46: =C41-C46 -> 3.3499999999999943 | E46: 3.3499999999999943 | F46: 40612 | G46: 203.74 | H46: 194.49857142900001 | I46: 197.33981818199999 | J46: -65.376932038299998 | K46: 222.86285714300001 | L46: -2.1818681318699999 | M46: -1.43381818182 | N46: FALSE | O46: TRUE | P46: 188.89 | Q46: -0.54417582416999999 | R46: -37.7 | S46: 191.08 | T46: 197.55 | U46: 206.21 | V46: TRUE | W46: 212.4 | X46: TRUE | Y46: 44.272347945299998 | Z46: 191.36 | AA46: TRUE | AB46: 182.7 | AC46: FALSE | AD46: nflx | AE46: 9990163
A47: 25.328746659 | B47: -37.896785719 | C47: 204.54 | D47: =C42-C47 -> 6.1800000000000068 | E47: 6.1800000000000068 | F47: 40613 | G47: 205.24 | H47: 197.28371428599999 | I47: 199.32781818199999 | J47: -54.688242092099998 | K47: 215.636285714 | L47: -1.4117362637399999 | M47: -0.81648484848500003 | N47: FALSE | O47: FALSE | P47: 200.11 | Q47: -0.77013186813000001 | R47: -31.09 | S47: 202.22 | T47: 203.29666666700001 | U47: 206.48333333299999 | V47: FALSE | W47: 208.42666666700001 | X47: FALSE | Y47: 47.801364645100001 | Z47: 201.35333333299999 | AA47: FALSE | AB47: 198.16666666699999 | AC47: FALSE | AD47: nflx | AE47: 5144020
A48: 23.9095435463 | B48: -38.789943365500001 | C48: 201.2 | D48: =C43-C48 -> 6.2000000000000171 | E48: 6.2000000000000171 | F48: 40616 | G48: 207 | H48: 198.09399999999999 | I48: 199.438909091 | J48: -46.746497302100003 | K48: 211.91171428600001 | L48: -1.0629010989000001 | M48: -0.67024242424199998 | N48: FALSE | O48: TRUE | P48: 198.82 | Q48: -0.34883516483999999 | R48: -20.4 | S48: 203.23 | T48: 202.34 | U48: 205.86 | V48: TRUE | W48: 210.52 | X48: FALSE | Y48: 45.508048665499999 | Z48: 197.68 | AA48: TRUE | AB48: 194.16 | AC48: FALSE | AD48: nflx | AE48: 4310130
A49: 23.2227808096 | B49: 102.222560441 | C49: 217.11 | D49: =C44-C49 -> -21.66 | E49: -21.66 | F49: 40617 | G49: 219.2 | H49: 202.092571429 | I49: 204.93654545499999 | J49: -27.1433667469 | K49: 208.75742857099999 | L49: -0.51268131868099998 | M49: 0.27412121212099999 | N49: FALSE | O49: FALSE | P49: 202 | Q49: -0.55021978021899998 | R49: 5.91 | S49: 202.48 | T49: 212.77 | U49: 223.54 | V49: TRUE | W49: 229.97 | X49: TRUE | Y49: 56.270406715699998 | Z49: 206.34 | AA49: FALSE | AB49: 195.57 | AC49: FALSE | AD49: nflx | AE49: 10959652
A50: 22.9799534944 | B50: 144.09304548700001 | C50: 213.84 | D50: =C45-C50 -> -20.85 | E50: -20.85 | F50: 40618 | G50: 223.37 | H50: 205.65 | I50: 208.543818182 | J50: 2.8247207633300002 | K50: 205.008571429 | L50: 4.9340659340699998E-2 | M50: 0.86218181818200001 | N50: TRUE | O50: FALSE | P50: 212.25 | Q50: -0.56202197802200005 | R50: -1.34 | S50: 221.03 | T50: 216.48666666700001 | U50: 220.723333333 | V50: FALSE | W50: 227.60666666700001 | X50: FALSE | Y50: 53.913539176900002 | Z50: 209.60333333299999 | AA50: FALSE | AB50: 205.366666667 | AC50: FALSE | AD50: nflx | AE50: 8507593
A51: 22.7544709875 | B51: 125.594239554 | C51: 213.9 | D51: =C46-C51 -> -13.88 | E51: -13.88 | F51: 40619 | G51: 219.67 | H51: 208.869714286 | I51: 211.475636364 | J51: 27.8626033894 | K51: 201.997428571 | L51: 0.52863736263700001 | M51: 1.2796969697 | N51: FALSE | O51: FALSE | P51: 212.85 | Q51: -0.47929670329599999 | R51: 1.46 | S51: 216.94 | T51: 215.473333333 | U51: 218.09666666699999 | V51: FALSE | W51: 222.29333333299999 | X51: FALSE | Y51: 53.951650793200002 | Z51: 211.276666667 | AA51: FALSE | AB51: 208.65333333300001 | AC51: FALSE | AD51: nflx | AE51: 4107380
A52: 21.772629250200001 | B52: 56.993421762099999 | C52: 209.4 | D52: =C47-C52 -> -4.8600000000000136 | E52: -4.8600000000000136 | F52: 40620 | G52: 214.44 | H52: 210.066285714 | I52: 213.748545455 | J52: 34.322341176099997 | K52: 201.19085714299999 | L52: 0.682725274725 | M52: 1.8141212121200001 | N52: FALSE | O52: TRUE | P52: 207.32 | Q52: -0.15408791208799999 | R52: 2.73 | S52: 213.56 | T52: 210.38666666699999 | U52: 213.45333333299999 | V52: FALSE | W52: 217.50666666699999 | X52: FALSE | Y52: 50.573690045200003 | Z52: 206.33333333300001 | AA52: TRUE | AB52: 203.26666666700001 | AC52: TRUE | AD52: nflx | AE52: 5481806
A53: 21.107111662699999 | B53: 69.265375467200002 | C53: 212.84 | D53: =C48-C53 -> -11.64 | E53: -11.64 | F53: 40623 | G53: 216.68 | H53: 211.77799999999999 | I53: 216.61781818200001 | J53: 40.558437950399998 | K53: 200.65199999999999 | L53: 0.85584615384600005 | M53: 2.3308484848500002 | N53: FALSE | O53: FALSE | P53: 207.55 | Q53: -0.17312087912099999 | R53: 8.21 | S53: 211.85 | T53: 212.35666666700001 | U53: 217.163333333 | V53: TRUE | W53: 221.48666666700001 | X53: FALSE | Y53: 52.9964539598 | Z53: 208.033333333 | AA53: FALSE | AB53: 203.22666666699999 | AC53: FALSE | AD53: nflx | AE53: 4652647
A54: 21.106946538199999 | B54: 134.348701818 | C54: 221.39 | D54: =C49-C54 -> -4.2799999999999727 | E54: -4.2799999999999727 | F54: 40624 | G54: 222.7 | H54: 215.39657142900001 | I54: 219.75399999999999 | J54: 50.750898018000001 | K54: 199.484857143 | L54: 1.2239780219800001 | M54: 2.45133333333 | N54: FALSE | O54: FALSE | P54: 218 | Q54: -0.36813186813400001 | R54: 17.16 | S54: 220.77 | T54: 220.69666666699999 | U54: 223.39333333299999 | V54: TRUE | W54: 225.39666666700001 | X54: TRUE | Y54: 58.448194327400003 | Z54: 218.693333333 | AA54: FALSE | AB54: 215.996666667 | AC54: FALSE | AD54: nflx | AE54: 6754652
A55: 21.7507964359 | B55: 154.83941541999999 | C55: 229.06 | D55: =C50-C55 -> -15.22 | E55: -15.22 | F55: 40625 | G55: 230 | H55: 220.374285714 | I55: 223.63290909099999 | J55: 59.644159490699998 | K55: 198.17714285700001 | L55: 1.70747252747 | M55: 2.5117575757599999 | N55: FALSE | O55: FALSE | P55: 218.61 | Q55: -0.48349450549 | R55: 25.69 | S55: 222.05 | T55: 225.89 | U55: 233.17 | V55: TRUE | W55: 237.28 | X55: TRUE | Y55: 62.635005695499999 | Z55: 221.78 | AA55: TRUE | AB55: 214.5 | AC55: FALSE | AD55: nflx | AE55: 8273325
A56: 22.598081117900001 | B56: 149.04687149599999 | C56: 229.13 | D56: =C51-C56 -> -15.23 | E56: -15.23 | F56: 40626 | G56: 233.12 | H56: 225.68600000000001 | I56: 226.974545455 | J56: 66.703384687799996 | K56: 195.49542857099999 | L56: 2.3223516483500002 | M56: 2.60745454545 | N56: TRUE | O56: FALSE | P56: 226.32 | Q56: -0.61487912087999996 | R56: 18.41 | S56: 231.98 | T56: 229.52333333300001 | U56: 232.72666666699999 | V56: FALSE | W56: 236.32333333299999 | X56: FALSE | Y56: 62.6719728387 | Z56: 225.92666666700001 | AA56: FALSE | AB56: 222.723333333 | AC56: FALSE | AD56: nflx | AE56: 6288174
A57: 23.3848454655 | B57: 122.712405455 | C57: 230.01 | D57: =C52-C57 -> -20.61 | E57: -20.61 | F57: 40627 | G57: 232.01 | H57: 230.22371428599999 | I57: 229.93636363600001 | J57: 70.163072814100005 | K57: 194.18771428599999 | L57: 2.7719999999999998 | M57: 2.6996363636399998 | N57: FALSE | O57: FALSE | P57: 226.58 | Q57: -0.44964835165 | R57: 22.61 | S57: 226.96 | T57: 229.533333333 | U57: 232.48666666700001 | V57: FALSE | W57: 234.96333333300001 | X57: FALSE | Y57: 63.165347523900003 | Z57: 227.056666667 | AA57: FALSE | AB57: 224.10333333299999 | AC57: FALSE | AD57: nflx | AE57: 4319782
A58: 24.8132738732 | B58: 147.88295069599999 | C58: 237.32 | D58: =C53-C58 -> -24.48 | E58: -24.48 | F58: 40630 | G58: 241.3 | H58: 234.28800000000001 | I58: 233.366181818 | J58: 71.198120274800004 | K58: 196.104857143 | L58: 2.9371648351599999 | M58: 2.65915151515 | N58: TRUE | O58: FALSE | P58: 233.34 | Q58: -0.16516483516 | R58: 41.87 | S58: 233.5 | T58: 237.32 | U58: 241.3 | V58: TRUE | W58: 245.28 | X58: TRUE | Y58: 67.060129090199993 | Z58: 233.34 | AA58: FALSE | AB58: 229.36 | AC58: FALSE | AD58: nflx | AE58: 7334767
A59: 26.139671680399999 | B59: 123.27491593800001 | C59: 237.38 | D59: =C54-C59 -> -15.99 | E59: -15.99 | F59: 40631 | G59: 238.88 | H59: 236.82 | I59: 238.028545455 | J59: 70.595239960800001 | K59: 199.91428571399999 | L59: 2.8389010989000001 | M59: 3.24478787879 | N59: FALSE | O59: FALSE | P59: 235 | Q59: 9.8263736259999998E-2 | R59: 44.39 | S59: 237.97 | T59: 237.086666667 | U59: 239.17333333299999 | V59: FALSE | W59: 240.966666667 | X59: FALSE | Y59: 67.090887314400007 | Z59: 235.29333333299999 | AA59: FALSE | AB59: 233.20666666700001 | AC59: FALSE | AD59: nflx | AE59: 3840800
A60: 27.601839097500001 | B60: 116.001622482 | C60: 237.95 | D60: =C55-C60 -> -8.8899999999999864 | E60: -8.8899999999999864 | F60: 40632 | G60: 242.17 | H60: 239.234571429 | I60: 241.128181818 | J60: 70.304353128900004 | K60: 202.91828571400001 | L60: 2.7935604395600002 | M60: 3.3978181818199999 | N60: TRUE | O60: FALSE | P60: 237.07 | Q60: 4.5340659339999999E-2 | R60: 37.93 | S60: 238.69 | T60: 239.063333333 | U60: 241.056666667 | V60: TRUE | W60: 244.163333333 | X60: TRUE | Y60: 67.402298801900002 | Z60: 235.95666666700001 | AA60: FALSE | AB60: 233.96333333300001 | AC60: FALSE | AD60: nflx | AE60: 3863235
A61: 28.577402445800001 | B61: 91.078305519899999 | C61: 237.78 | D61: =C56-C61 -> -8.6500000000000057 | E61: -8.6500000000000057 | F61: 40633 | G61: 239.7 | H61: 241.16742857099999 | I61: 242.86600000000001 | J61: 69.852660950399994 | K61: 205.73400000000001 | L61: 2.7256483516499999 | M61: 3.2533333333300001 | N61: FALSE | O61: TRUE | P61: 235.04 | Q61: 6.7912087910000002E-2 | R61: 33.24 | S61: 237.28 | T61: 237.50666666699999 | U61: 239.973333333 | V61: FALSE | W61: 242.16666666699999 | X61: FALSE | Y61: 67.198062022399995 | Z61: 235.313333333 | AA61: TRUE | AB61: 232.84666666699999 | AC61: FALSE | AD61: nflx | AE61: 3548451
A62: 29.835945048900001 | B62: 108.924510867 | C62: 242.09 | D62: =C57-C62 -> -12.08 | E62: -12.08 | F62: 40634 | G62: 244.44 | H62: 242.78171428600001 | I62: 243.890181818 | J62: 68.391826118099999 | K62: 209.961142857 | L62: 2.52465934066 | M62: 2.7544848484800002 | N62: FALSE | O62: FALSE | P62: 240.4 | Q62: 0.20098901098999999 | R62: 40.89 | S62: 241 | T62: 242.31 | U62: 244.22 | V62: TRUE | W62: 246.35 | X62: TRUE | Y62: 69.704465029299996 | Z62: 240.18 | AA62: FALSE | AB62: 238.27 | AC62: FALSE | AD62: nflx | AE62: 5402515
A63: 31.197668306600001 | B63: 110.327850509 | C63: 244.72 | D63: =C58-C63 -> -7.4000000000000057 | E63: -7.4000000000000057 | F63: 40637 | G63: 247.21 | H63: 246.17685714300001 | I63: 244.72781818199999 | J63: 69.973861681499997 | K63: 210.51028571399999 | L63: 2.7435824175799999 | M63: 2.2321818181799999 | N63: FALSE | O63: FALSE | P63: 242.77 | Q63: -0.21892307691999999 | R63: 27.61 | S63: 244.83 | T63: 244.9 | U63: 247.03 | V63: TRUE | W63: 249.34 | X63: TRUE | Y63: 71.152956273399994 | Z63: 242.59 | AA63: FALSE | AB63: 240.46 | AC63: FALSE | AD63: nflx | AE63: 3437884
A64: 32.561979306799998 | B64: 97.387574837200006 | C64: 244.23 | D64: =C59-C64 -> -6.8499999999999943 | E64: -6.8499999999999943 | F64: 40638 | G64: 248.65 | H64: 248.19 | I64: 245.367272727 | J64: 69.809697859099998 | K64: 212.83857142900001 | L64: 2.7193406593399998 | M64: 1.8667272727299999 | N64: FALSE | O64: FALSE | P64: 242.27 | Q64: 2.4241758240000001E-2 | R64: 30.39 | S64: 244.6 | T64: 245.05 | U64: 247.83 | V64: TRUE | W64: 251.43 | X64: FALSE | Y64: 70.476859587199996 | Z64: 241.45 | AA64: TRUE | AB64: 238.67 | AC64: FALSE | AD64: nflx | AE64: 3799294
A65: 33.026117700699999 | B65: 70.224940047999993 | C65: 239.97 | D65: =C60-C65 -> -2.0200000000000102 | E65: -2.0200000000000102 | F65: 40639 | G65: 248.88 | H65: 248.24799999999999 | I65: 244.82327272699999 | J65: 67.729071723999994 | K65: 216.50485714300001 | L65: 2.44178021978 | M65: 1.50339393939 | N65: TRUE | O65: FALSE | P65: 238.32 | Q65: 0.27756043955999998 | R65: 26.07 | S65: 248 | T65: 242.39 | U65: 246.46 | V65: TRUE | W65: 252.95 | X65: FALSE | Y65: 64.719185186499999 | Z65: 235.9 | AA65: TRUE | AB65: 231.83 | AC65: TRUE | AD65: nflx | AE65: 5758066
A66: 32.171948691200001 | B66: -2.50420875421 | C66: 233.96 | D66: =C61-C66 -> 3.8199999999999932 | E66: 3.8199999999999932 | F66: 40640 | G66: 236.47 | H66: 245.372857143 | I66: 241.62200000000001 | J66: 59.964289601799997 | K66: 222.888571429 | L66: 1.7295604395599999 | M66: 0.68466666666700005 | N66: FALSE | O66: TRUE | P66: 231.03 | Q66: 0.71221978021999999 | R66: 24.56 | S66: 235.38 | T66: 233.82 | U66: 236.61 | V66: FALSE | W66: 239.26 | X66: FALSE | Y66: 57.573077464699999 | Z66: 231.17 | AA66: TRUE | AB66: 228.38 | AC66: TRUE | AD66: nflx | AE66: 5982712
A67: 31.706623407399999 | B67: -0.28741184426600003 | C67: 234.86 | D67: =C62-C67 -> 7.2299999999999898 | E67: 7.2299999999999898 | F67: 40641 | G67: 239.7 | H67: 242.51885714299999 | I67: 238.64418181799999 | J67: 46.356423452599998 | K67: 228.88828571400001 | L67: 1.0485054945100001 | M67: -8.4848484848499994E-2 | N67: TRUE | O67: FALSE | P67: 232.69 | Q67: 0.68105494504999997 | R67: 22.02 | S67: 235.94 | T67: 235.75 | U67: 238.81 | V67: TRUE | W67: 242.76 | X67: TRUE | Y67: 58.315353368899999 | Z67: 231.8 | AA67: FALSE | AB67: 228.74 | AC67: FALSE | AD67: nflx | AE67: 5517953
A68: 30.3100668921 | B68: -86.762512120500006 | C68: 228.16 | D68: =C63-C68 -> 16.56 | E68: 16.56 | F68: 40644 | G68: 235.71 | H68: 238.53428571399999 | I68: 234.54927272699999 | J68: 19.854595487400001 | K68: 233.84 | L68: 0.361098901099 | M68: -0.79127272727300002 | N68: FALSE | O68: FALSE | P68: 226.48 | Q68: 0.68740659341099997 | R68: 6.77 | S68: 232.78 | T68: 230.116666667 | U68: 233.753333333 | V68: FALSE | W68: 239.34666666699999 | X68: FALSE | Y68: 51.142053728 | Z68: 224.52333333300001 | AA68: TRUE | AB68: 220.88666666699999 | AC68: TRUE | AD68: nflx | AE68: 4477608
A69: 28.7157252089 | B69: -90.196735290500001 | C69: 233.92 | D69: =C64-C69 -> 10.31 | E69: 10.31 | F69: 40645 | G69: 233.92 | H69: 236.93314285700001 | I69: 232.955818182 | J69: 3.5114172916999999 | K69: 236.13542857100001 | L69: 6.1362637362600003E-2 | M69: -1.06848484848 | N69: FALSE | O69: TRUE | P69: 224.41 | Q69: 0.29973626373599999 | R69: 4.86 | S69: 224.87 | T69: 230.75 | U69: 237.09 | V69: TRUE | W69: 240.26 | X69: FALSE | Y69: 56.137371064200003 | Z69: 227.58 | AA69: TRUE | AB69: 221.24 | AC69: FALSE | AD69: nflx | AE69: 5786041
A70: 27.806886137500001 | B70: -11.536436180999999 | C70: 238.75 | D70: =C65-C70 -> 1.22 | E70: 1.22 | F70: 40646 | G70: 238.85 | H70: 236.44514285700001 | I70: 233.333636364 | J70: -6.8104955584200004 | K70: 237.99771428599999 | L70: -0.119428571429 | M70: -1.0023030303 | N70: FALSE | O70: FALSE | P70: 232.27 | Q70: 0.180791208792 | R70: 9.62 | S70: 236.48 | T70: 236.62333333300001 | U70: 240.97666666699999 | V70: TRUE | W70: 243.20333333299999 | X70: FALSE | Y70: 59.844848172600003 | Z70: 234.39666666700001 | AA70: FALSE | AB70: 230.04333333299999 | AC70: FALSE | AD70: nflx | AE70: 4350378
A71: 27.1399925636 | B71: -16.281122394499999 | C71: 236.73 | D71: =C66-C71 -> -2.7699999999999818 | E71: -2.7699999999999818 | F71: 40647 | G71: 240.45 | H71: 235.288571429 | I71: 232.93600000000001 | J71: -20.3653685759 | K71: 240.114285714 | L71: -0.37120879120900002 | M71: -1.0673333333299999 | N71: TRUE | O71: FALSE | P71: 233.75 | Q71: 0.25178021977999998 | R71: 6.72 | S71: 237.98 | T71: 236.97666666699999 | U71: 240.20333333299999 | V71: FALSE | W71: 243.67666666700001 | X71: FALSE | Y71: 57.6501578767 | Z71: 233.503333333 | AA71: TRUE | AB71: 230.276666667 | AC71: FALSE | AD71: nflx | AE71: 5139685
A72: 26.434249668900001 | B72: -45.326506088400002 | C72: 235.49 | D72: =C67-C72 -> -0.62999999999999545 | E72: -0.62999999999999545 | F72: 40648 | G72: 236.96 | H72: 234.66542857100001 | I72: 233.02927272700001 | J72: -24.083068976700002 | K72: 240.476 | L72: -0.44696703296700002 | M72: -0.89993939393900002 | N72: FALSE | O72: FALSE | P72: 233.23 | Q72: 7.5758241758E-2 | R72: -1.83 | S72: 236.63 | T72: 235.22666666699999 | U72: 237.223333333 | V72: FALSE | W72: 238.95666666700001 | X72: FALSE | Y72: 56.285579102299998 | Z72: 233.49333333300001 | AA72: TRUE | AB72: 231.496666667 | AC72: FALSE | AD72: nflx | AE72: 3134829
A73: 24.947027024499999 | B73: -93.254568970999998 | C73: 233.33 | D73: =C68-C73 -> -5.1700000000000159 | E73: -5.1700000000000159 | F73: 40651 | G73: 234.17 | H73: 233.547714286 | I73: 233.262363636 | J73: -29.873817034199998 | K73: 241.015142857 | L73: -0.57441758241800001 | M73: -0.59503030303000004 | N73: FALSE | O73: TRUE | P73: 228.02 | Q73: 0.12745054945100001 | R73: -4.05 | S73: 232.01 | T73: 231.84 | U73: 235.66 | V73: FALSE | W73: 237.99 | X73: FALSE | Y73: 53.8925731442 | Z73: 229.51 | AA73: TRUE | AB73: 225.69 | AC73: TRUE | AD73: nflx | AE73: 3111663
A74: 24.529355549000002 | B74: 22.285128205100001 | C74: 241.55 | D74: =C69-C74 -> -7.6300000000000239 | E74: -7.6300000000000239 | F74: 40652 | G74: 242.29 | H74: 234.740857143 | I74: 236.85836363600001 | J74: -23.287893926399999 | K74: 240.33628571400001 | L74: -0.43041758241799999 | M74: 0.26363636363600002 | N74: FALSE | O74: FALSE | P74: 231.86 | Q74: -0.14399999999999999 | R74: 3.6 | S74: 233.77 | T74: 238.56666666699999 | U74: 245.27333333300001 | V74: TRUE | W74: 248.996666667 | X74: TRUE | Y74: 60.734259796700002 | Z74: 234.843333333 | AA74: FALSE | AB74: 228.13666666699999 | AC74: FALSE | AD74: nflx | AE74: 5157321
A75: 24.4738488164 | B75: 83.855026438400003 | C75: 244.43 | D75: =C70-C75 -> -5.6800000000000068 | E75: -5.6800000000000068 | F75: 40653 | G75: 245.51 | H75: 236.54742857100001 | I75: 240.74345454499999 | J75: -12.7109433632 | K75: 239.47971428599999 | L75: -0.22556043955999999 | M75: 1.02787878788 | N75: FALSE | O75: FALSE | P75: 239.41 | Q75: -0.204857142858 | R75: 6.65 | S75: 243.39 | T75: 243.116666667 | U75: 246.82333333299999 | V75: TRUE | W75: 249.216666667 | X75: FALSE | Y75: 62.816123580999999 | Z75: 240.723333333 | AA75: FALSE | AB75: 237.01666666700001 | AC75: FALSE | AD75: nflx | AE75: 4222732
A76: 25.261484452400001 | B76: 173.39357833 | C76: 251.67 | D76: =C71-C76 -> -14.94 | E76: -14.94 | F76: 40658 | G76: 254.98 | H76: 240.64142857100001 | I76: 245.684363636 | J76: 16.647242794499999 | K76: 236.75428571399999 | L76: 0.29901098901099998 | M76: 1.7323030303 | N76: TRUE | O76: FALSE | P76: 248 | Q76: -0.52457142857100003 | R76: 9.58 | S76: 254.71 | T76: 251.55 | U76: 255.1 | V76: TRUE | W76: 258.53 | X76: TRUE | Y76: 67.483502336900003 | Z76: 248.12 | AA76: FALSE | AB76: 244.57 | AC76: FALSE | AD76: nflx | AE76: 10150173
A77: 23.497468734800002 | B77: -65.229891217599999 | C77: 228.91 | D77: =C72-C77 -> 6.5800000000000125 | E77: 6.5800000000000125 | F77: 40659 | G77: 242.23 | H77: 238.984857143 | I77: 241.97672727299999 | J77: 12.292060666399999 | K77: 236.15228571399999 | L77: 0.21789010988999999 | M77: 1.04060606061 | N77: FALSE | O77: FALSE | P77: 227.3 | Q77: 8.1120879120999995E-2 | R77: -15.81 | S77: 237.11 | T77: 232.813333333 | U77: 238.32666666700001 | V77: FALSE | W77: 247.74333333300001 | X77: FALSE | Y77: 47.358540456199997 | Z77: 223.39666666700001 | AA77: TRUE | AB77: 217.883333333 | AC77: TRUE | AD77: nflx | AE77: 15819859
A78: 22.064796336699999 | B78: -62.850251599499998 | C78: 235.96 | D78: =C73-C78 -> -2.63 | E78: -2.63 | F78: 40660 | G78: 236.61 | H78: 239.52285714300001 | I78: 239.68909090899999 | J78: 21.382253905599999 | K78: 234.43285714300001 | L78: 0.39153846153799998 | M78: 0.35890909090899997 | N78: FALSE | O78: TRUE | P78: 225.15 | Q78: -0.17364835164799999 | R78: -8.27 | S78: 228.67 | T78: 232.57333333299999 | U78: 239.996666667 | V78: FALSE | W78: 244.033333333 | X78: FALSE | Y78: 52.121526315499999 | Z78: 228.53666666699999 | AA78: FALSE | AB78: 221.11333333300001 | AC78: FALSE | AD78: nflx | AE78: 8070459
A79: 20.533903976600001 | B79: -10.655604653299999 | C79: 234.37 | D79: =C74-C79 -> 7.1800000000000068 | E79: 7.1800000000000068 | F79: 40661 | G79: 239.44 | H79: 239.279714286 | I79: 237.578727273 | J79: 22.571206503399999 | K79: 233.876 | L79: 0.41567032967 | M79: -0.120060606061 | N79: TRUE | O79: FALSE | P79: 232.64 | Q79: -2.4131868131999999E-2 | R79: -5.6 | S79: 233 | T79: 235.48333333299999 | U79: 238.32666666700001 | V79: FALSE | W79: 242.283333333 | X79: FALSE | Y79: 51.000745760900003 | Z79: 231.526666667 | AA79: FALSE | AB79: 228.68333333300001 | AC79: FALSE | AD79: nflx | AE79: 4408551
A80: 19.121852449199999 | B80: -48.563413906299999 | C80: 232.67 | D80: =C75-C80 -> 11.76 | E80: 11.76 | F80: 40662 | G80: 235.47 | H80: 237.900857143 | I80: 235.82254545500001 | J80: 12.2824429275 | K80: 235.07057142900001 | L80: 0.21771428571400001 | M80: -0.37521212121199998 | N80: FALSE | O80: TRUE | P80: 231.7 | Q80: 0.197956043956 | R80: -1.29 | S80: 232.8 | T80: 233.28 | U80: 234.86 | V80: FALSE | W80: 237.05 | X80: FALSE | Y80: 49.768507859099998 | Z80: 231.09 | AA80: FALSE | AB80: 229.51 | AC80: FALSE | AD80: nflx | AE80: 3058830
A81: 18.172237055699998 | B81: 17.314777393100002 | C81: 237.19 | D81: =C76-C81 -> 14.48 | E81: 14.48 | F81: 40665 | G81: 239.87 | H81: 237.84971428599999 | I81: 235.555454545 | J81: 10.439206069300001 | K81: 235.454571429 | L81: 0.18424175824200001 | M81: -0.44478787878800002 | N81: TRUE | O81: FALSE | P81: 234.4 | Q81: 3.3472527471999997E-2 | R81: 2.33 | S81: 238.22 | T81: 237.15333333300001 | U81: 239.906666667 | V81: TRUE | W81: 242.62333333300001 | X81: TRUE | Y81: 53.018757586500001 | Z81: 234.436666667 | AA81: FALSE | AB81: 231.68333333300001 | AC81: FALSE | AD81: nflx | AE81: 5080504
A82: 17.160647493999999 | B82: -80.156268782300003 | C82: 231.24 | D82: =C77-C82 -> -2.3300000000000125 | E82: -2.3300000000000125 | F82: 40666 | G82: 235.94 | H82: 235.24485714299999 | I82: 232.95981818199999 | J82: -14.0552046903 | K82: 238.49942857100001 | L82: -0.25035164835200002 | M82: -0.92715151515200001 | N82: FALSE | O82: FALSE | P82: 228 | Q82: 0.43459340659399998 | R82: 3.08 | S82: 235.69 | T82: 231.72666666699999 | U82: 235.45333333299999 | V82: FALSE | W82: 239.66666666699999 | X82: FALSE | Y82: 48.564054118800001 | Z82: 227.51333333299999 | AA82: TRUE | AB82: 223.78666666699999 | AC82: TRUE | AD82: nflx | AE82: 4640442
A83: 16.499142937999999 | B83: -125.022732042 | C83: 229.19 | D83: =C78-C83 -> 6.7700000000000102 | E83: 6.7700000000000102 | F83: 40667 | G83: 232 | H83: 232.84771428600001 | I83: 229.455818182 | J83: -29.560382905499999 | K83: 240.22085714299999 | L83: -0.56716483516500005 | M83: -1.6138181818199999 | N83: FALSE | O83: TRUE | P83: 225.3 | Q83: 0.31681318681300003 | R83: -4.73 | S83: 231.8 | T83: 228.83 | U83: 232.36 | V83: FALSE | W83: 235.53 | X83: FALSE | Y83: 47.0958269399 | Z83: 225.66 | AA83: TRUE | AB83: 222.13 | AC83: FALSE | AD83: nflx | AE83: 4789912
A84: 15.6693655927 | B84: -89.222770195400003 | C84: 230.31 | D84: =C79-C84 -> 4.06 | E84: 4.06 | F84: 40668 | G84: 233.78 | H84: 231.56371428599999 | I84: 228.20854545500001 | J84: -33.899365716699997 | K84: 240.29914285699999 | L84: -0.67195604395599995 | M84: -1.6412121212099999 | N84: TRUE | O84: FALSE | P84: 226.22 | Q84: 0.104791208791 | R84: -8.44 | S84: 226.39 | T84: 230.10333333299999 | U84: 233.98666666700001 | V84: TRUE | W84: 237.663333333 | X84: FALSE | Y84: 48.020439466900001 | Z84: 226.42666666700001 | AA84: FALSE | AB84: 222.54333333299999 | AC84: FALSE | AD84: nflx | AE84: 3928265
A85: 14.8988580577 | B85: -72.791466904499998 | C85: 229.47 | D85: =C80-C85 -> 3.1999999999999886 | E85: 3.1999999999999886 | F85: 40669 | G85: 233.14 | H85: 230.01628571399999 | I85: 227.860181818 | J85: -39.700873802700002 | K85: 240.80942857100001 | L85: -0.83024175824199997 | M85: -1.3861818181800001 | N85: FALSE | O85: FALSE | P85: 229 | Q85: 0.158285714286 | R85: -7.26 | S85: 232.77 | T85: 230.53666666699999 | U85: 232.07333333299999 | V85: FALSE | W85: 234.67666666700001 | X85: FALSE | Y85: 47.352012092599999 | Z85: 227.93333333300001 | AA85: FALSE | AB85: 226.39666666700001 | AC85: FALSE | AD85: nflx | AE85: 3162906
A86: 13.954270598000001 | B86: -4.92927753838 | C86: 236.41 | D86: =C81-C86 -> 0.78000000000000114 | E86: 0.78000000000000114 | F86: 40672 | G86: 236.8 | H86: 230.28371428599999 | I86: 232.17327272700001 | J86: -38.632155556400001 | K86: 240.67342857099999 | L86: -0.79920879120900001 | M86: -8.8606060606100004E-2 | N86: FALSE | O86: FALSE | P86: 231.36 | Q86: -3.1032967033E-2 | R86: 0.92 | S86: 231.8 | T86: 234.85666666700001 | U86: 238.35333333299999 | V86: TRUE | W86: 240.29666666700001 | X86: TRUE | Y86: 53.153865195800002 | Z86: 232.913333333 | AA86: FALSE | AB86: 229.41666666699999 | AC86: FALSE | AD86: nflx | AE86: 4126164
A87: 13.409468464 | B87: 28.2417538694 | C87: 237.63 | D87: =C82-C87 -> -6.3899999999999864 | E87: -6.3899999999999864 | F87: 40673 | G87: 239.5 | H87: 230.53 | I87: 233.188181818 | J87: -38.9580139905 | K87: 241.04142857100001 | L87: -0.80857142857099995 | M87: -5.6848484848499997E-2 | N87: FALSE | O87: FALSE | P87: 235.01 | Q87: 9.3626373619999995E-3 | R87: 4.3 | S87: 237.16 | T87: 237.38 | U87: 239.75 | V87: TRUE | W87: 241.87 | X87: FALSE | Y87: 54.111227741199997 | Z87: 235.26 | AA87: FALSE | AB87: 232.89 | AC87: FALSE | AD87: nflx | AE87: 3839461
A88: 13.2621083087 | B88: 70.441128050399996 | C88: 240.67 | D88: =C83-C88 -> -11.48 | E88: -11.48 | F88: 40674 | G88: 242.5 | H88: 232.609428571 | I88: 236.18763636400001 | J88: -25.5939087458 | K88: 238.83628571400001 | L88: -0.47898901098899999 | M88: 0.50503030302999996 | N88: FALSE | O88: FALSE | P88: 238.01 | Q88: -0.32958241758200002 | R88: -0.88 | S88: 239.05 | T88: 240.39333333299999 | U88: 242.776666667 | V88: TRUE | W88: 244.883333333 | X88: TRUE | Y88: 56.496954838400001 | Z88: 238.28666666699999 | AA88: FALSE | AB88: 235.90333333300001 | AC88: FALSE | AD88: nflx | AE88: 4766891
A89: 13.6038267368 | B89: 121.069066448 | C89: 245.77 | D89: =C84-C89 -> -15.46 | E89: -15.46 | F89: 40675 | G89: 246.75 | H89: 236.436857143 | I89: 240.374 | J89: 5.4336763370399996 | K89: 235.20028571399999 | L89: 9.5120879120900004E-2 | M89: 1.1819999999999999 | N89: FALSE | O89: FALSE | P89: 239.39 | Q89: -0.57410989011000002 | R89: 1.34 | S89: 241.2 | T89: 243.97 | U89: 248.55 | V89: TRUE | W89: 251.33 | X89: TRUE | Y89: 60.232263330000002 | Z89: 241.19 | AA89: FALSE | AB89: 236.61 | AC89: FALSE | AD89: nflx | AE89: 5234806
A90: 14.226098182499999 | B90: 181.766338886 | C90: 246.52 | D90: =C85-C90 -> -17.05 | E90: -17.05 | F90: 40676 | G90: 249.62 | H90: 241.45314285699999 | I90: 243.857636364 | J90: 42.720946333100002 | K90: 229.44828571400001 | L90: 0.92345054945100002 | M90: 1.6483636363600001 | N90: TRUE | O90: FALSE | P90: 243.33 | Q90: -0.82832967033000005 | R90: -5.15 | S90: 244.13 | T90: 246.49 | U90: 249.65 | V90: TRUE | W90: 252.78 | X90: FALSE | Y90: 60.7657795358 | Z90: 243.36 | AA90: FALSE | AB90: 240.2 | AC90: FALSE | AD90: nflx | AE90: 5047374
A91: 13.493084272999999 | B91: 52.351516524499999 | C91: 237.09 | D91: =C86-C91 -> -0.68000000000000682 | E91: -0.68000000000000682 | F91: 40679 | G91: 246.07 | H91: 240.940285714 | I91: 244.23218181799999 | J91: 37.040370636900001 | K91: 231.129714286 | L91: 0.75465934065899998 | M91: 1.73381818182 | N91: FALSE | O91: FALSE | P91: 234.3 | Q91: 0.16879120879199999 | R91: 8.18 | S91: 246 | T91: 239.15333333300001 | U91: 244.00666666699999 | V91: FALSE | W91: 250.92333333299999 | X91: FALSE | Y91: 51.424216701100001 | Z91: 232.23666666700001 | AA91: TRUE | AB91: 227.383333333 | AC91: TRUE | AD91: nflx | AE91: 4852540
A92: 12.6471426536 | B92: -11.171846003300001 | C92: 236.94 | D92: =C87-C92 -> 0.68999999999999773 | E92: 0.68999999999999773 | F92: 40680 | G92: 238.08 | H92: 241.16228571400001 | I92: 243.37036363600001 | J92: 37.884484903800001 | K92: 231.047714286 | L92: 0.77804395604400001 | M92: 1.41563636364 | N92: FALSE | O92: TRUE | P92: 231.11 | Q92: -2.3384615385000002E-2 | R92: 0.98 | S92: 235 | T92: 235.37666666699999 | U92: 239.64333333299999 | V92: FALSE | W92: 242.34666666699999 | X92: FALSE | Y92: 51.289149403099998 | Z92: 232.67333333299999 | AA92: TRUE | AB92: 228.406666667 | AC92: FALSE | AD92: nflx | AE92: 4238055
A93: 12.3006485439 | B93: 72.044009690899998 | C93: 242.54 | D93: =C88-C93 -> -1.87 | E93: -1.87 | F93: 40681 | G93: 243.7 | H93: 242.569142857 | I93: 243.722181818 | J93: 42.135748241800002 | K93: 230.80799999999999 | L93: 0.90470329670299998 | M93: 1.1971515151500001 | N93: FALSE | O93: FALSE | P93: 237.26 | Q93: -0.126659340659 | R93: 8.17 | S93: 237.4 | T93: 241.16666666699999 | U93: 245.07333333299999 | V93: TRUE | W93: 247.60666666700001 | X93: TRUE | Y93: 55.941705902400003 | Z93: 238.633333333 | AA93: FALSE | AB93: 234.72666666699999 | AC93: FALSE | AD93: nflx | AE93: 4421687
A94: 12.171313122400001 | B94: 87.576446535900004 | C94: 242.73 | D94: =C89-C94 -> 3.0400000000000205 | E94: 3.0400000000000205 | F94: 40682 | G94: 245.39 | H94: 243.54857142899999 | I94: 243.63545454499999 | J94: 43.375253061800002 | K94: 231.26571428599999 | L94: 0.94483516483499996 | M94: 0.901878787879 | N94: FALSE | O94: FALSE | P94: 241.1 | Q94: -4.0131868132000002E-2 | R94: 10.06 | S94: 243.5 | T94: 243.07333333299999 | U94: 245.04666666700001 | V94: TRUE | W94: 247.36333333300001 | X94: FALSE | Y94: 56.094931336499997 | Z94: 240.75666666699999 | AA94: FALSE | AB94: 238.783333333 | AC94: FALSE | AD94: nflx | AE94: 3392561
A95: 12.2249066171 | B95: 92.640857351199998 | C95: 245.9 | D95: =C90-C95 -> 0.62000000000000455 | E95: 0.62000000000000455 | F95: 40683 | G95: 246.89 | H95: 245.70142857100001 | I95: 243.798363636 | J95: 49.728030948600001 | K95: 230.35714285700001 | L95: 1.1803296703299999 | M95: 0.57296969697 | N95: FALSE | O95: FALSE | P95: 241.16 | Q95: -0.23549450549500001 | R95: 8.71 | S95: 241.58 | T95: 244.65 | U95: 248.14 | V95: TRUE | W95: 250.38 | X95: FALSE | Y95: 58.6770983961 | Z95: 242.41 | AA95: FALSE | AB95: 238.92 | AC95: FALSE | AD95: nflx | AE95: 4401161
A96: 12.6174111895 | B96: 95.549083355899995 | C96: 247.83 | D96: =C91-C96 -> -10.74 | E96: -10.74 | F96: 40686 | G96: 249.88 | H96: 247.25171428600001 | I96: 245.11981818199999 | J96: 51.036965094800003 | K96: 231.17685714300001 | L96: 1.2365274725299999 | M96: 0.61284848484800003 | N96: FALSE | O96: TRUE | P96: 240 | Q96: -5.6197802200000001E-2 | R96: 16.59 | S96: 243.02 | T96: 245.90333333300001 | U96: 251.806666667 | V96: TRUE | W96: 255.783333333 | X96: FALSE | Y96: 60.211401106899999 | Z96: 241.92666666700001 | AA96: TRUE | AB96: 236.02333333300001 | AC96: FALSE | AD96: nflx | AE96: 4977245
A97: 13.2912878296 | B97: 123.049261832 | C97: 247.6 | D97: =C92-C97 -> -10.66 | E97: -10.66 | F97: 40687 | G97: 252.68 | H97: 247.976 | I97: 245.98290909100001 | J97: 48.883326792299997 | K97: 233.08257142900001 | L97: 1.14564835165 | M97: 0.58309090909100003 | N97: FALSE | O97: FALSE | P97: 246.62 | Q97: 9.0879120879999997E-2 | R97: 18.41 | S97: 249.89 | T97: 248.966666667 | U97: 251.313333333 | V97: TRUE | W97: 255.026666667 | X97: FALSE | Y97: 59.925846198899997 | Z97: 245.253333333 | AA97: FALSE | AB97: 242.906666667 | AC97: FALSE | AD97: nflx | AE97: 4544713
A98: 14.6306099899 | B98: 181.62084628299999 | C98: 259.47 | D98: =C93-C98 -> -16.93 | E98: -16.93 | F98: 40688 | G98: 259.94 | H98: 251.38657142900001 | I98: 251.01072727299999 | J98: 53.4693599728 | K98: 233.83771428599999 | L98: 1.3499120879099999 | M98: 1.28260606061 | N98: FALSE | O98: FALSE | P98: 247.17 | Q98: -0.20426373626 | R98: 29.16 | S98: 247.94 | T98: 255.526666667 | U98: 263.883333333 | V98: TRUE | W98: 268.29666666700001 | X98: TRUE | Y98: 68.285317786099995 | Z98: 251.11333333300001 | AA98: FALSE | AB98: 242.75666666699999 | AC98: FALSE | AD98: nflx | AE98: 7949640
A99: 16.366810623799999 | B99: 222.67808300600001 | C99: 263.75 | D99: =C94-C99 -> -21.02 | E99: -21.02 | F99: 40689 | G99: 265.88 | H99: 254.94457142900001 | I99: 257.51163636400003 | J99: 56.669560425299998 | K99: 235.17685714300001 | L99: 1.52059340659 | M99: 2.3276969696999998 | N99: FALSE | O99: FALSE | P99: 258.56 | Q99: -0.17068131868 | R99: 34.28 | S99: 259.3 | T99: 262.73 | U99: 266.9 | V99: TRUE | W99: 270.05 | X99: FALSE | Y99: 70.661754924999997 | Z99: 259.58 | AA99: FALSE | AB99: 255.41 | AC99: FALSE | AD99: nflx | AE99: 5959656
A100: 18.341000156900002 | B100: 208.63366924499999 | C100: 270.8 | D100: =C95-C100 -> -24.9 | E100: -24.90 | F100: 40694 | G100: 270.8 | H100: 260.32742857099998 | I100: 265.617272727 | J100: 63.096545705899999 | K100: 234.70685714300001 | L100: 1.9708131868100001 | M100: 3.5893939393899998 | N100: FALSE | O100: FALSE | P100: 264.4 | Q100: -0.45021978021999998 | R100: 34.39 | S100: 267.25 | T100: 268.66666666700002 | U100: 272.93333333300001 | V100: TRUE | W100: 275.06666666699999 | X100: TRUE | Y100: 74.103908333600003 | Z100: 266.53333333299997 | AA100: FALSE | AB100: 262.26666666699998 | AC100: FALSE | AD100: nflx | AE100: 4814056
A101: 20.3704093853 | B101: 154.385798091 | C101: 267.26 | D101: =C96-C101 -> -19.43 | E101: -19.43 | F101: 40695 | G101: 273.64 | H101: 263.99171428599999 | I101: 269.28963636399999 | J101: 65.643509650200002 | K101: 235.27542857099999 | L101: 2.20894505495 | M101: 3.7350303030299998 | N101: TRUE | O101: FALSE | P101: 265.5 | Q101: -0.23813186814000001 | R101: 29.63 | S101: 269.47 | T101: 268.8 | U101: 272.1 | V101: TRUE | W101: 276.94 | X101: FALSE | Y101: 69.682901904000005 | Z101: 263.96 | AA101: TRUE | AB101: 260.66 | AC101: FALSE | AD101: nflx | AE101: 5958725
A102: 21.992469766500001 | B102: 123.441084557 | C102: 271.7 | D102: =C97-C102 -> -24.1 | E102: -24.10 | F102: 40696 | G102: 272.98 | H102: 268.38542857099998 | I102: 272.82018181799998 | J102: 68.540441408199996 | K102: 235.31457142900001 | L102: 2.5439120879099999 | M102: 3.7471515151500001 | N102: FALSE | O102: TRUE | P102: 264.12 | Q102: -0.33496703296000002 | R102: 31.03 | S102: 266.05 | T102: 269.6 | U102: 275.08 | V102: TRUE | W102: 278.46 | X102: FALSE | Y102: 71.943762831000001 | Z102: 266.22 | AA102: FALSE | AB102: 260.74 | AC102: FALSE | AD102: nflx | AE102: 4297072
A103: 23.742082351099999 | B103: 117.097576184 | C103: 273.7 | D103: =C98-C103 -> -14.23 | E103: -14.23 | F103: 40697 | G103: 276.24 | H103: 273.13542857099998 | I103: 276.26563636399999 | J103: 71.378515895000007 | K103: 234.55457142899999 | L103: 2.9677582417599999 | M103: 3.8203636363600002 | N103: FALSE | O103: FALSE | P103: 269.5 | Q103: -0.42384615385000002 | R103: 27.93 | S103: 270 | T103: 273.14666666699998 | U103: 276.79333333300002 | V103: TRUE | W103: 279.88666666699999 | X103: FALSE | Y103: 72.923284199799994 | Z103: 270.05333333300001 | AA103: FALSE | AB103: 266.40666666700002 | AC103: FALSE | AD103: nflx | AE103: 4995889
A104: 23.802130463899999 | B104: 69.323016379500004 | C104: 262.59 | D104: =C99-C104 -> 1.160000000000025 | E104: 1.160000000000025 | F104: 40700 | G104: 277.7 | H104: 274.33771428599999 | I104: 274.21145454499998 | J104: 71.427310837099995 | K104: 235.648 | L104: 2.97613186813 | M104: 2.9225454545499998 | N104: TRUE | O104: TRUE | P104: 260.61 | Q104: -8.3736263699999997E-3 | R104: 16.07 | S104: 275.9 | T104: 266.96666666700003 | U104: 273.32333333299999 | V104: TRUE | W104: 284.056666667 | X104: FALSE | Y104: 60.324060086000003 | Z104: 256.23333333300002 | AA104: TRUE | AB104: 249.87666666699999 | AC104: TRUE | AD104: nflx | AE104: 6561138
A105: 23.8578894258 | B105: 44.818032729700001 | C105: 263.69 | D105: =C100-C105 -> 7.1100000000000136 | E105: 7.1100000000000136 | F105: 40701 | G105: 267.44 | H105: 274.01657142900001 | I105: 272.08800000000002 | J105: 69.213711748700007 | K105: 239.76914285699999 | L105: 2.6344175824199998 | M105: 2.0553333333300001 | N105: FALSE | O105: FALSE | P105: 260.78 | Q105: 0.34171428571000001 | R105: 26.6 | S105: 262.75 | T105: 263.97 | U105: 267.16 | V105: FALSE | W105: 270.63 | X105: FALSE | Y105: 61.0417556608 | Z105: 260.5 | AA105: FALSE | AB105: 257.31 | AC105: FALSE | AD105: nflx | AE105: 5202316
A106: 23.530731616499999 | B106: 25.535296994700001 | C106: 262.26 | D106: =C101-C106 -> 5 | E106: 5.00 | F106: 40702 | G106: 265.44 | H106: 272.54628571400002 | I106: 268.88618181800001 | J106: 64.850488565899994 | K106: 244.85657142900001 | L106: 2.12997802198 | M106: 1.0231515151499999 | N106: FALSE | O106: FALSE | P106: 258.5 | Q106: 0.50443956044000005 | R106: 25.32 | S106: 263.26 | T106: 262.06666666699999 | U106: 265.633333333 | V106: FALSE | W106: 269.00666666699999 | X106: FALSE | Y106: 59.534084052600001 | Z106: 258.693333333 | AA106: TRUE | AB106: 255.12666666699999 | AC106: FALSE | AD106: nflx | AE106: 3980782
A107: 23.1758419461 | B107: 15.833336619100001 | C107: 262.57 | D107: =C102-C107 -> 9.13 | E107: 9.13 | F107: 40703 | G107: 264.48 | H107: 271.232285714 | I107: 264.958363636 | J107: 59.647696816600003 | K107: 249.03200000000001 | L107: 1.7077142857100001 | M107: -0.18236363636399999 | N107: FALSE | O107: FALSE | P107: 258.2 | Q107: 0.42226373627000002 | R107: 20.03 | S107: 262.22 | T107: 261.75 | U107: 265.3 | V107: FALSE | W107: 268.03 | X107: FALSE | Y107: 59.766081077899997 | Z107: 259.02 | AA107: TRUE | AB107: 255.47 | AC107: FALSE | AD107: nflx | AE107: 3084626
A108: 22.777575890000001 | B108: -5.5711499656200001 | C108: 258.62 | D108: =C103-C108 -> 15.08 | E108: 15.08 | F108: 40704 | G108: 264.6 | H108: 268.35742857100001 | I108: 261.22345454499998 | J108: 47.487043810099998 | K108: 254.17685714300001 | L108: 1.0908131868099999 | M108: -0.993454545455 | N108: TRUE | O108: FALSE | P108: 257.82 | Q108: 0.6169010989 | R108: 15.89 | S108: 261.62 | T108: 260.34666666700002 | U108: 262.87333333300001 | V108: FALSE | W108: 267.12666666699999 | X108: FALSE | Y108: 55.407159899100002 | Z108: 256.09333333299998 | AA108: TRUE | AB108: 253.56666666699999 | AC108: FALSE | AD108: nflx | AE108: 4360087
A109: 21.852097539799999 | B109: -41.224700149900002 | C109: 257.22 | D109: =C104-C109 -> 5.3699999999999477 | E109: 5.3699999999999477 | F109: 40707 | G109: 263 | H109: 265.12142857100002 | I109: 257.90727272700002 | J109: 25.1064460459 | K109: 259.03 | L109: 0.46857142857099998 | M109: -1.58527272727 | N109: FALSE | O109: TRUE | P109: 254.74 | Q109: 0.62224175823899996 | R109: 11.32 | S109: 259.78 | T109: 258.32 | U109: 261.9 | V109: TRUE | W109: 266.58 | X109: FALSE | Y109: 53.906504311699997 | Z109: 253.64 | AA109: TRUE | AB109: 250.06 | AC109: FALSE | AD109: nflx | AE109: 3321623
A110: 20.992724786 | B110: -45.935560153700003 | C110: 261.13 | D110: =C105-C110 -> 2.56 | E110: 2.56 | F110: 40708 | G110: 261.6 | H110: 262.84314285699998 | I110: 257.70800000000003 | J110: -1.6088958044599999 | K110: 263.208285714 | L110: -2.8087912087899999E-2 | M110: -1.4146666666700001 | N110: FALSE | O110: FALSE | P110: 255.94 | Q110: 0.49665934065900003 | R110: 13.3 | S110: 259.8 | T110: 259.556666667 | U110: 263.17333333300002 | V110: FALSE | W110: 265.21666666700003 | X110: FALSE | Y110: 57.378485940799997 | Z110: 257.51333333299999 | AA110: FALSE | AB110: 253.89666666700001 | AC110: FALSE | AD110: nflx | AE110: 3048499
A111: 20.377140521899999 | B111: -76.454809746400002 | C111: 257.12 | D111: =C106-C111 -> 5.1399999999999864 | E111: 5.1399999999999864 | F111: 40709 | G111: 262.77 | H111: 259.12085714300002 | I111: 255.94290909099999 | J111: -35.197713505199999 | K111: 268.29057142900001 | L111: -0.70536263736299998 | M111: -1.58157575758 | N111: TRUE | O111: FALSE | P111: 256.29 | Q111: 0.67727472527499999 | R111: 9.52 | S111: 259.48 | T111: 258.72666666700002 | U111: 261.16333333300003 | V111: FALSE | W111: 265.20666666699998 | X111: FALSE | Y111: 52.971587334399999 | Z111: 254.68333333300001 | AA111: TRUE | AB111: 252.246666667 | AC111: FALSE | AD111: nflx | AE111: 3179885
A112: 19.953807637499999 | B112: -176.83421476699999 | C112: 249.3 | D112: =C107-C112 -> 13.27 | E112: 13.27 | F112: 40710 | G112: 260.58 | H112: 254.81142857099999 | I112: 252.917454545 | J112: -51.487142928700003 | K112: 271.14714285700001 | L112: -1.25659340659 | M112: -1.7561212121200001 | N112: FALSE | O112: TRUE | P112: 244.26 | Q112: 0.55123076922699998 | R112: -10.17 | S112: 256.45 | T112: 251.38 | U112: 258.5 | V112: FALSE | W112: 267.7 | X112: FALSE | Y112: 45.614090879999999 | Z112: 242.18 | AA112: TRUE | AB112: 235.06 | AC112: TRUE | AD112: nflx | AE112: 5626072
A113: 19.560712816199999 | B113: -181.659877588 | C113: 245.67 | D113: =C108-C113 -> 12.95 | E113: 12.95 | F113: 40711 | G113: 251.84 | H113: 250.47057142899999 | I113: 250.259818182 | J113: -59.909302906699999 | K113: 272.90514285699999 | L113: -1.72573626374 | M113: -1.72381818182 | N113: FALSE | O113: FALSE | P113: 244.7 | Q113: 0.46914285714999998 | R113: -18.08 | S113: 251.05 | T113: 247.40333333300001 | U113: 250.10666666700001 | V113: FALSE | W113: 254.54333333299999 | X113: FALSE | Y113: 42.652557022800003 | Z113: 242.966666667 | AA113: FALSE | AB113: 240.26333333299999 | AC113: FALSE | AD113: nflx | AE113: 4079591
A114: 19.778351111199999 | B114: -172.98623486 | C114: 245.63 | D114: =C109-C114 -> 11.59 | E114: 11.59 | F114: 40714 | G114: 247.81 | H114: 247.64314285699999 | I114: 246.89527272699999 | J114: -62.042943456800003 | K114: 272.13685714299999 | L114: -1.8841318681300001 | M114: -2.0946060606099999 | N114: FALSE | O114: TRUE | P114: 240.12 | Q114: 0.15839560439 | R114: -25.17 | S114: 241.86 | T114: 244.52 | U114: 248.92 | V114: FALSE | W114: 252.21 | X114: FALSE | Y114: 42.619719807700001 | Z114: 241.23 | AA114: TRUE | AB114: 236.83 | AC114: TRUE | AD114: nflx | AE114: 2808281
A115: 18.793909302300001 | B115: -92.164137519500002 | C115: 253.65 | D115: =C110-C115 -> 7.4799999999999898 | E115: 7.4799999999999898 | F115: 40715 | G115: 254.8 | H115: 247.09142857099999 | I115: 247.446363636 | J115: -61.206079839700003 | K115: 270.744285714 | L115: -1.81945054945 | M115: -1.7490303030300001 | N115: TRUE | O115: FALSE | P115: 242.86 | Q115: -6.4681318680000002E-2 | R115: -13.61 | S115: 245.69 | T115: 250.436666667 | U115: 258.01333333299999 | V115: TRUE | W115: 262.37666666699999 | X115: TRUE | Y115: 50.798663309399998 | Z115: 246.07333333299999 | AA115: FALSE | AB115: 238.496666667 | AC115: FALSE | AD115: nflx | AE115: 3090222
A116: 17.8797847654 | B116: -81.545725515000001 | C116: 248.66 | D116: =C111-C116 -> 8.460000000000008 | E116: 8.460000000000008 | F116: 40716 | G116: 253.24 | H116: 246.279714286 | I116: 246.53527272700001 | J116: -59.403491595600002 | K116: 268.264571429 | L116: -1.69114285714 | M116: -1.6492727272700001 | N116: FALSE | O116: FALSE | P116: 247.68 | Q116: -0.12830769231 | R116: -23.04 | S116: 251.8 | T116: 249.86 | U116: 252.04 | V116: FALSE | W116: 255.42 | X116: FALSE | Y116: 46.3699084418 | Z116: 246.48 | AA116: FALSE | AB116: 244.3 | AC116: FALSE | AD116: nflx | AE116: 3127940
A117: 17.2803412146 | B117: -29.7843377477 | C117: 255.72 | D117: =C112-C117 -> -6.4199999999999875 | E117: -6.4199999999999875 | F117: 40717 | G117: 260.85 | H117: 248.22742857099999 | I117: 248.866909091 | J117: -50.051044302800001 | K117: 263.74828571400002 | L117: -1.19391208791 | M117: -0.97890909090900002 | N117: TRUE | O117: TRUE | P117: 244.7 | Q117: -0.49723076922999998 | R117: -17.98 | S117: 245.14 | T117: 253.75666666699999 | U117: 262.813333333 | V117: TRUE | W117: 269.90666666700002 | X117: TRUE | Y117: 52.658587209799997 | Z117: 246.663333333 | AA117: TRUE | AB117: 237.60666666700001 | AC117: FALSE | AD117: nflx | AE117: 5250356
A118: 16.7237150602 | B118: 19.3797139142 | C118: 256.96 | D118: =C113-C118 -> -11.29 | E118: -11.29 | F118: 40718 | G118: 260.5 | H118: 249.42057142900001 | I118: 251.21054545499999 | J118: -43.485494196399998 | K118: 261.75085714300002 | L118: -0.94848351648399998 | M118: -0.42121212121200002 | N118: FALSE | O118: FALSE | P118: 254.09 | Q118: -0.245428571426 | R118: -5.63 | S118: 257 | T118: 257.18333333300001 | U118: 260.27666666699997 | V118: FALSE | W118: 263.59333333299998 | X118: FALSE | Y118: 53.685814551500002 | Z118: 253.866666667 | AA118: FALSE | AB118: 250.77333333300001 | AC118: FALSE | AD118: nflx | AE118: 4867142
A119: 15.8023566317 | B119: 38.764497460199998 | C119: 260.12 | D119: =C114-C119 -> -14.49 | E119: -14.49 | F119: 40721 | G119: 262.46 | H119: 251.744285714 | I119: 254.45636363599999 | J119: -28.888079756700002 | K119: 258.91714285699999 | L119: -0.55175824175800003 | M119: 0.23563636363599999 | N119: FALSE | O119: TRUE | P119: 251.64 | Q119: -0.396725274726 | R119: -3.57 | S119: 254.9 | T119: 258.07333333299999 | U119: 264.50666666699999 | V119: TRUE | W119: 268.89333333299999 | X119: FALSE | Y119: 56.288779783400003 | Z119: 253.686666667 | AA119: TRUE | AB119: 247.253333333 | AC119: FALSE | AD119: nflx | AE119: 3308852
A120: 15.5364686568 | B120: 116.11677201400001 | C120: 265.09 | D120: =C115-C120 -> -11.44 | E120: -11.44 | F120: 40722 | G120: 266.59 | H120: 255.243714286 | I120: 260.04290909100001 | J120: -2.5470386255399999 | K120: 255.822 | L120: -4.4483516483499998E-2 | M120: 1.3890909090900001 | N120: FALSE | O120: FALSE | P120: 260.57 | Q120: -0.50727472527399997 | R120: 2.83 | S120: 261.92 | T120: 264.08333333299998 | U120: 267.59666666700002 | V120: TRUE | W120: 270.10333333300002 | X120: FALSE | Y120: 60.088138586699998 | Z120: 261.57666666699998 | AA120: FALSE | AB120: 258.063333333 | AC120: FALSE | AD120: nflx | AE120: 2357552
A121: 15.577900804900001 | B121: 126.297660415 | C121: 264.94 | D121: =C116-C121 -> -16.28 | E121: -16.28 | F121: 40723 | G121: 268.74 | H121: 258.66800000000001 | I121: 264.55963636400003 | J121: 24.526536571699999 | K121: 252.73628571399999 | L121: 0.45628571428600001 | M121: 2.2190303030299998 | N121: TRUE | O121: FALSE | P121: 263 | Q121: -0.50076923077000002 | R121: 2.37 | S121: 266.99 | T121: 265.56 | U121: 268.12 | V121: TRUE | W121: 271.3 | X121: FALSE | Y121: 59.918860602300001 | Z121: 262.38 | AA121: FALSE | AB121: 259.82 | AC121: FALSE | AD121: nflx | AE121: 2605899
A122: 15.2169560014 | B122: 86.694405099099995 | C122: 262.69 | D122: =C117-C122 -> -6.97 | E122: -6.97 | F122: 40724 | G122: 265 | H122: 260.88171428599998 | I122: 266.308545455 | J122: 36.947991793699998 | K122: 251.10400000000001 | L122: 0.75213186813199995 | M122: 2.3101212121199999 | N122: FALSE | O122: TRUE | P122: 260.8 | Q122: -0.29584615384599999 | R122: 4.07 | S122: 264.7 | T122: 262.83 | U122: 264.86 | V122: FALSE | W122: 267.03 | X122: FALSE | Y122: 57.3107628761 | Z122: 260.66 | AA122: TRUE | AB122: 258.63 | AC122: FALSE | AD122: nflx | AE122: 2567080
A123: 17.323700266500001 | B123: 259.439843263 | C123: 289.63 | D123: =#REF!-C123 -> #REF! | E123: -32.67 | F123: 40729 | G123: 291.23 | H123: 269.70657142900001 | I123: 275.90763636399998 | J123: 60.306492756499999 | K123: 246.90914285700001 | L123: 1.7536483516500001 | M123: 3.4663636363600001 | N123: FALSE | O123: FALSE | P123: 275.71 | Q123: -1.0015164835199999 | R123: 32.41 | S123: 276 | T123: 285.52333333299998 | U123: 295.33666666699997 | V123: TRUE | W123: 301.04333333300002 | X123: TRUE | Y123: 72.657097974500005 | Z123: 279.81666666699999 | AA123: FALSE | AB123: 270.003333333 | AC123: FALSE | AD123: nflx | AE123: 8991452
A124: 19.3137443651 | B124: 201.40468455000001 | C124: 290.96 | D124: =#REF!-C124 -> #REF! | E124: -30.84 | F124: 40730 | G124: 291.78 | H124: 278.50599999999997 | I124: 283.56036363599998 | J124: 70.213124105399999 | K124: 242.371142857 | L124: 2.7796043955999998 | M124: 4.1596363636399998 | N124: FALSE | O124: FALSE | P124: 284.5 | Q124: -1.02595604395 | R124: 29.83 | S124: 286.65 | T124: 289.08 | U124: 293.66 | V124: FALSE | W124: 296.36 | X124: FALSE | Y124: 73.169897191100006 | Z124: 286.38 | AA124: FALSE | AB124: 281.8 | AC124: FALSE | AD124: nflx | AE124: 4663264
A125: 21.495752427100001 | B125: 169.398458998 | C125: 292.42 | D125: =C120-C125 -> -27.33 | E125: -27.33 | F125: 40731 | G125: 297.35 | H125: 286.255714286 | I125: 290.848909091 | J125: 74.409766533500004 | K125: 239.66428571399999 | L125: 3.5839560439599998 | M125: 4.9177575757599996 | N125: TRUE | O125: FALSE | P125: 291.63 | Q125: -0.80435164835999995 | R125: 35.3 | S125: 293.43 | T125: 293.8 | U125: 295.97 | V125: TRUE | W125: 299.52 | X125: TRUE | Y125: 73.751849443400005 | Z125: 290.25 | AA125: FALSE | AB125: 288.08 | AC125: FALSE | AD125: nflx | AE125: 3826768
A126: 22.780571047799999 | B126: 127.686119417 | C126: 295.14 | D126: =#REF!-C126 -> #REF! | E126: -30.20 | F126: 40732 | G126: 295.8 | H126: 292.57914285700002 | I126: 295.96436363599997 | J126: 76.140364479499993 | K126: 239.889428571 | L126: 4.0530549450500004 | M126: 5.0216363636399999 | N126: FALSE | O126: FALSE | P126: 287.12 | Q126: -0.46909890109000002 | R126: 45.84 | S126: 288.26 | T126: 292.686666667 | U126: 298.253333333 | V126: FALSE | W126: 301.366666667 | X126: FALSE | Y126: 74.846472633100007 | Z126: 289.57333333299999 | AA126: TRUE | AB126: 284.00666666699999 | AC126: TRUE | AD126: nflx | AE126: 2965548
A127: 24.345973780400001 | B127: 102.653587993 | C127: 290.74 | D127: =C122-C127 -> -28.05 | E127: -28.05 | F127: 40735 | G127: 301.5 | H127: 295.94285714300003 | I127: 298.43654545499999 | J127: 76.213041093300006 | K127: 242.964285714 | L127: 4.0752747252699999 | M127: 4.7927878787899996 | N127: TRUE | O127: FALSE | P127: 286.9 | Q127: -2.2219780219999999E-2 | R127: 45.07 | S127: 294.83 | T127: 293.04666666700001 | U127: 299.193333333 | V127: TRUE | W127: 307.64666666699998 | X127: TRUE | Y127: 69.777175176300005 | Z127: 284.59333333299998 | AA127: TRUE | AB127: 278.44666666699999 | AC127: FALSE | AD127: nflx | AE127: 5276111
A128: 25.782768414700001 | B128: 79.915907928099998 | C128: 291.27 | D128: =C123-C128 -> -1.6399999999999864 | E128: -1.6399999999999864 | F128: 40736 | G128: 296.29 | H128: 298.14942857099999 | I128: 299.42963636399998 | J128: 75.665145221200007 | K128: 247.27771428599999 | L128: 3.9132087912100002 | M128: 4.2510303030300003 | N128: FALSE | O128: TRUE | P128: 286.8 | Q128: 0.16206593406 | R128: 45.64 | S128: 291.93 | T128: 291.45333333299999 | U128: 296.10666666700001 | V128: FALSE | W128: 300.943333333 | X128: FALSE | Y128: 70.040396083600001 | Z128: 286.616666667 | AA128: FALSE | AB128: 281.96333333299998 | AC128: FALSE | AD128: nflx | AE128: 5194539
A129: 27.630585008200001 | B129: 97.768608759599999 | C129: 298.73 | D129: =C124-C129 -> -7.7700000000000387 | E129: -7.7700000000000387 | F129: 40737 | G129: 304.79 | H129: 302.11599999999999 | I129: 301.76036363600002 | J129: 76.0577276251 | K129: 249.75114285699999 | L129: 4.0280659340699998 | M129: 3.9109696969700001 | N129: TRUE | O129: FALSE | P129: 296.6 | Q129: -0.11485714286 | R129: 45.08 | S129: 300.7 | T129: 300.04 | U129: 303.48 | V129: TRUE | W129: 308.23 | X129: TRUE | Y129: 73.534338354200003 | Z129: 295.29 | AA129: FALSE | AB129: 291.85 | AC129: FALSE | AD129: nflx | AE129: 7034969
A130: 27.647377338999998 | B130: 52.314865390400001 | C130: 286.62 | D130: =C125-C130 -> 5.8000000000000114 | E130: 5.8000000000000114 | F130: 40738 | G130: 300 | H130: 300.96771428599999 | I130: 298.79563636400002 | J130: 73.765326009800006 | K130: 256.32228571399997 | L130: 3.4342637362600001 | M130: 2.7736969697 | N130: FALSE | O130: FALSE | P130: 285.26 | Q130: 0.59380219780999999 | R130: 37.96 | S130: 299.5 | T130: 290.62666666699999 | U130: 295.99333333300001 | V130: FALSE | W130: 305.366666667 | X130: FALSE | Y130: 61.081238012500002 | Z130: 281.253333333 | AA130: TRUE | AB130: 275.88666666699999 | AC130: TRUE | AD130: nflx | AE130: 5845527
A131: 27.193238185199998 | B131: 26.185272750199999 | C131: 286.93 | D131: =C126-C131 -> 8.2099999999999795 | E131: 8.2099999999999795 | F131: 40739 | G131: 289.75 | H131: 299.82314285699999 | I131: 294.73363636400001 | J131: 71.066565431900003 | K131: 261.925428571 | L131: 2.91520879121 | M131: 1.38236363636 | N131: FALSE | O131: FALSE | P131: 281.62 | Q131: 0.51905494505000005 | R131: 31.21 | S131: 287.96 | T131: 286.1 | U131: 290.58 | V131: FALSE | W131: 294.23 | X131: FALSE | Y131: 61.262091008299997 | Z131: 282.45 | AA131: FALSE | AB131: 277.97 | AC131: FALSE | AD131: nflx | AE131: 4067580
A132: 25.896879143300001 | B132: -20.9006919479 | C132: 279 | D132: =C127-C132 -> 11.74 | E132: 11.74 | F132: 40742 | G132: 282.47 | H132: 295.924857143 | I132: 286.28272727299998 | J132: 64.250650468499998 | K132: 268.97228571400001 | L132: 2.0732747252700001 | M132: -0.85806060606099999 | N132: FALSE | O132: TRUE | P132: 274.24 | Q132: 0.84193406593999998 | R132: 22.04 | S132: 282.46 | T132: 278.57 | U132: 282.9 | V132: FALSE | W132: 286.8 | X132: FALSE | Y132: 54.309613691300001 | Z132: 274.67 | AA132: TRUE | AB132: 270.34 | AC132: TRUE | AD132: nflx | AE132: 4123248
A133: 25.287866558699999 | B133: 17.936963713000001 | C133: 287.29 | D133: =C128-C133 -> 3.9799999999999613 | E133: 3.9799999999999613 | F133: 40743 | G133: 289.31 | H133: 293.98 | I133: 285.19400000000002 | J133: 55.872979920900001 | K133: 274.79857142899999 | L133: 1.4754945054899999 | M133: -1.048 | N133: TRUE | O133: FALSE | P133: 283.94 | Q133: 0.59778021977999996 | R133: 27.17 | S133: 284 | T133: 286.84666666700002 | U133: 289.753333333 | V133: TRUE | W133: 292.21666666700003 | X133: TRUE | Y133: 59.4859179344 | Z133: 284.383333333 | AA133: FALSE | AB133: 281.47666666700002 | AC133: FALSE | AD133: nflx | AE133: 2737312
A134: 24.063251707199999 | B134: -35.595863560600002 | C134: 281.4 | D134: =C129-C134 -> 17.33 | E134: 17.33 | F134: 40744 | G134: 284.9 | H134: 290.45428571399998 | I134: 282.46418181799999 | J134: 37.010673233600002 | K134: 280.65428571400003 | L134: 0.75384615384599996 | M134: -1.4421818181799999 | N134: FALSE | O134: FALSE | P134: 278.02 | Q134: 0.72164835164399999 | R134: 16.31 | S134: 283 | T134: 281.44 | U134: 284.86 | V134: FALSE | W134: 288.32 | X134: FALSE | Y134: 54.740754338099997 | Z134: 277.98 | AA134: TRUE | AB134: 274.56 | AC134: TRUE | AD134: nflx | AE134: 2846261
A135: 22.617477472699999 | B135: -80.545678858299993 | C135: 275.81 | D135: =C130-C135 -> 10.81 | E135: 10.81 | F135: 40745 | G135: 284.78 | H135: 285.00371428599999 | I135: 278.61672727299998 | J135: -11.5385926913 | K135: 287.65771428599999 | L135: -0.20415384615400001 | M135: -1.9280606060600001 | N135: FALSE | O135: FALSE | P135: 275.11 | Q135: 0.95799999999999996 | R135: 10.87 | S135: 281.5 | T135: 278.56666666699999 | U135: 282.02333333299998 | V135: FALSE | W135: 288.23666666700001 | X135: FALSE | Y135: 50.614173402799999 | Z135: 272.35333333300002 | AA135: TRUE | AB135: 268.89666666699998 | AC135: FALSE | AD135: nflx | AE135: 3240576
A136: 21.197351018199999 | B136: -143.84503110399999 | C136: 276.58 | D136: =C131-C136 -> 10.35 | E136: 10.35 | F136: 40746 | G136: 278.7 | H136: 279.11914285699999 | I136: 276.48527272699999 | J136: -51.609368666999998 | K136: 295.526571429 | L136: -1.2621098901100001 | M136: -1.9892727272699999 | N136: FALSE | O136: TRUE | P136: 270.55 | Q136: 1.05795604396 | R136: 13.89 | S136: 272.99 | T136: 275.27666666699997 | U136: 280.003333333 | V136: FALSE | W136: 283.42666666700001 | X136: FALSE | Y136: 51.160328417000002 | Z136: 271.85333333300002 | AA136: TRUE | AB136: 267.12666666699999 | AC136: FALSE | AD136: nflx | AE136: 3395770
A137: 20.163694486099999 | B137: -63.335624098899999 | C137: 281.53 | D137: =C132-C137 -> -2.5299999999999727 | E137: -2.5299999999999727 | F137: 40749 | G137: 285.5 | H137: 277.95914285700002 | I137: 276.19618181800001 | J137: -53.5027973921 | K137: 295.52942857099998 | L137: -1.35156043956 | M137: -1.84884848485 | N137: TRUE | O137: FALSE | P137: 277.4 | Q137: 8.945054945E-2 | R137: -8.1 | S137: 280.57 | T137: 281.47666666700002 | U137: 285.55333333300001 | V137: TRUE | W137: 289.57666666699998 | X137: TRUE | Y137: 54.633661879999998 | Z137: 277.45333333299999 | AA137: FALSE | AB137: 273.37666666699999 | AC137: FALSE | AD137: nflx | AE137: 7529702
A138: 20.335572469500001 | B138: -200.52551748799999 | C138: 266.91 | D138: =C133-C138 -> 20.38 | E138: 20.38 | F138: 40750 | G138: 268.29 | H138: 273.46114285700003 | I138: 271.46490909099998 | J138: -60.662848324899997 | K138: 296.59171428600001 | L138: -1.7792747252700001 | M138: -2.3589090909100001 | N138: FALSE | O138: TRUE | P138: 251.46 | Q138: 0.42771428570999998 | R138: -24.05 | S138: 255.6 | T138: 262.22 | U138: 272.98 | V138: FALSE | W138: 279.05 | X138: FALSE | Y138: 44.555110243999998 | Z138: 256.15 | AA138: TRUE | AB138: 245.39 | AC138: TRUE | AD138: nflx | AE138: 13866896
A139: 19.960279377599999 | B139: -109.493901061 | C139: 269.42 | D139: =C134-C139 -> 11.98 | E139: 11.98 | F139: 40751 | G139: 274 | H139: 270.50428571399999 | I139: 270.42145454500002 | J139: -63.220544200900001 | K139: 296.26285714300002 | L139: -1.98142857143 | M139: -1.9394545454500001 | N139: TRUE | O139: FALSE | P139: 267.2 | Q139: 0.20215384616000001 | R139: -23 | S139: 269.57 | T139: 270.20666666699998 | U139: 273.21333333299998 | V139: TRUE | W139: 277.00666666699999 | X139: FALSE | Y139: 46.383819729499997 | Z139: 266.41333333300003 | AA139: FALSE | AB139: 263.40666666700002 | AC139: FALSE | AD139: nflx | AE139: 5463656
A140: 19.884790031600001 | B140: -118.336418671 | C140: 266.62 | D140: =C135-C140 -> 9.19 | E140: 9.19 | F140: 40752 | G140: 270.71 | H140: 267.873142857 | I140: 267.58745454500001 | J140: -64.245658651599996 | K140: 294.81971428600002 | L140: -2.0728131868099999 | M140: -2.1247878787899999 | N140: FALSE | O140: FALSE | P140: 263.11 | Q140: 9.1384615380000006E-2 | R140: -28.52 | S140: 264.33 | T140: 266.813333333 | U140: 270.51666666699998 | V140: FALSE | W140: 274.41333333300003 | X140: FALSE | Y140: 44.615981043300003 | Z140: 262.91666666700002 | AA140: TRUE | AB140: 259.21333333299998 | AC140: TRUE | AD140: nflx | AE140: 4046892
A141: 19.988485104799999 | B141: -116.131736745 | C141: 265.99 | D141: =C136-C141 -> 10.59 | E141: 10.59 | F141: 40753 | G141: 266.72 | H141: 265.26628571399999 | I141: 265.68872727299998 | J141: -65.574575743799997 | K141: 293.89085714300001 | L141: -2.2018901098899999 | M141: -2.0813939393899998 | N141: FALSE | O141: FALSE | P141: 260.5 | Q141: 0.12907692307999999 | R141: -24.75 | S141: 261.09 | T141: 264.40333333299998 | U141: 268.306666667 | V141: FALSE | W141: 270.62333333300001 | X141: FALSE | Y141: 44.207716739299997 | Z141: 262.08666666699997 | AA141: TRUE | AB141: 258.18333333300001 | AC141: FALSE | AD141: nflx | AE141: 3337222
A142: 19.796427418099999 | B142: -101.942297004 | C142: 263.38 | D142: =C137-C142 -> 18.15 | E142: 18.15 | F142: 40756 | G142: 269.5 | H142: 262.77114285699997 | I142: 262.44454545500002 | J142: -66.311206307800006 | K142: 292.40171428600001 | L142: -2.2792747252700001 | M142: -2.4552121212100002 | N142: TRUE | O142: FALSE | P142: 258.76 | Q142: 7.7384615379999994E-2 | R142: -27.89 | S142: 268.54 | T142: 263.88 | U142: 269 | V142: TRUE | W142: 274.62 | X142: FALSE | Y142: 42.473690741200002 | Z142: 258.26 | AA142: TRUE | AB142: 253.14 | AC142: FALSE | AD142: nflx | AE142: 3699477
A143: 19.753473424999999 | B143: -109.37368246 | C143: 257.2 | D143: =C138-C143 -> 9.7100000000000364 | E143: 9.7100000000000364 | F143: 40757 | G143: 267.6 | H143: 260.54942857100002 | I143: 259.57545454500001 | J143: -65.205089827899997 | K143: 288.69057142899999 | L143: -2.1647032966999999 | M143: -2.4241212121200002 | N143: FALSE | O143: FALSE | P143: 256.94 | Q143: -0.11457142856999999 | R143: -41.53 | S143: 261.74 | T143: 260.58 | U143: 264.22 | V143: FALSE | W143: 271.24 | X143: FALSE | Y143: 38.611717253199998 | Z143: 253.56 | AA143: TRUE | AB143: 249.92 | AC143: FALSE | AD143: nflx | AE143: 3339788
A144: 20.135142198600001 | B144: -113.249431442 | C144: 260 | D144: =C139-C144 -> 9.4200000000000159 | E144: 9.4200000000000159 | F144: 40758 | G144: 261.5 | H144: 258.50428571399999 | I144: 258.13690909100001 | J144: -65.426024763100003 | K144: 286.93285714299998 | L144: -2.1868131868099998 | M144: -2.2682424242399999 | N144: FALSE | O144: FALSE | P144: 251.13 | Q144: 2.2109890109999999E-2 | R144: -26.62 | S144: 256.14 | T144: 257.54333333300002 | U144: 263.95666666699998 | V144: FALSE | W144: 267.91333333300003 | X144: FALSE | Y144: 41.219531021500003 | Z144: 253.586666667 | AA144: TRUE | AB144: 247.17333333299999 | AC144: FALSE | AD144: nflx | AE144: 3563115
A145: 20.914305079799998 | B145: -144.386846652 | C145: 245.77 | D145: =C140-C145 -> 20.85 | E145: 20.85 | F145: 40759 | G145: 260.27 | H145: 253.604857143 | I145: 251.83181818200001 | J145: -68.105463590499994 | K145: 285.95228571400003 | L145: -2.48826373626 | M145: -3.00181818182 | N145: FALSE | O145: FALSE | P145: 244.76 | Q145: 0.30145054944999999 | R145: -41.16 | S145: 257.05 | T145: 250.26666666700001 | U145: 255.77333333300001 | V145: FALSE | W145: 265.77666666699997 | X145: FALSE | Y145: 33.443843146799999 | Z145: 240.26333333299999 | AA145: TRUE | AB145: 234.75666666699999 | AC145: TRUE | AD145: nflx | AE145: 4747743
A146: 22.133123585100002 | B146: -163.46213621800001 | C146: 241.11 | D146: =C141-C146 -> 24.88 | E146: 24.88 | F146: 40760 | G146: 250.87 | H146: 247.55028571400001 | I146: 245.709454545 | J146: -71.584298253 | K146: 286.59399999999999 | L146: -3.00336263736 | M146: -3.5741212121200001 | N146: FALSE | O146: FALSE | P146: 236.43 | Q146: 0.51509890110000001 | R146: -37.89 | S146: 248.54 | T146: 242.80333333300001 | U146: 249.17666666700001 | V146: FALSE | W146: 257.24333333300001 | X146: FALSE | Y146: 31.357692936599999 | Z146: 234.73666666700001 | AA146: TRUE | AB146: 228.36333333300001 | AC146: FALSE | AD146: nflx | AE146: 5412081
A147: 23.9850073882 | B147: -212.42493163500001 | C147: 226.64 | D147: =C142-C147 -> 36.74 | E147: 36.74 | F147: 40763 | G147: 235.66 | H147: 240.041714286 | I147: 237.513090909 | J147: -74.0201280454 | K147: 285.43828571400002 | L147: -3.4920439560399998 | M147: -4.1757575757599996 | N147: FALSE | O147: TRUE | P147: 221.5 | Q147: 0.48868131867999998 | R147: -60.65 | S147: 229.95 | T147: 227.93333333300001 | U147: 234.366666667 | V147: FALSE | W147: 242.093333333 | X147: FALSE | Y147: 25.945649817500001 | Z147: 220.20666666700001 | AA147: TRUE | AB147: 213.77333333300001 | AC147: TRUE | AD147: nflx | AE147: 5328420
A148: 25.7046137769 | B148: -331.02270552599998 | C148: 237.8 | D148: =C143-C148 -> 19.4 | E148: 19.40 | F148: 40764 | G148: 0 | H148: 236.29428571400001 | I148: 233.24199999999999 | J148: -74.432472976599996 | K148: 282.95714285700001 | L148: -3.58945054945 | M148: -4.4779999999999998 | N148: FALSE | O148: FALSE | P148: 224.13 | Q148: 9.7406593410000006E-2 | R148: -43.6 | S148: 0 | T148: 153.97666666699999 | U148: 83.823333333299999 | V148: FALSE | W148: -70.153333333299997 | X148: FALSE | Y148: 35.2303716499 | Z148: 307.95333333299999 | AA148: FALSE | AB148: 378.10666666700001 | AC148: FALSE | AD148: nflx | AE148: 5278123
A149: 28.3874065943 | B149: -52.656292063599999 | C149: 232.42 | D149: =C144-C149 -> 27.58 | E149: 27.58 | F149: 40765 | G149: 239.99 | H149: 231.610571429 | I149: 229.20218181800001 | J149: -75.378671331000007 | K149: 281.44228571399998 | L149: -3.8332087912100001 | M149: -4.5535151515200001 | N149: FALSE | O149: FALSE | P149: 231.14 | Q149: 0.24375824175999999 | R149: -43.39 | S149: 233.5 | T149: 234.51666666700001 | U149: 237.89333333299999 | V149: TRUE | W149: 243.366666667 | X149: TRUE | Y149: 33.077334185200002 | Z149: 229.04333333299999 | AA149: TRUE | AB149: 225.66666666699999 | AC149: TRUE | AD149: nflx | AE149: 3154623
A150: 30.928168541400002 | B150: -24.911628364799999 | C150: 243.13 | D150: =C145-C150 -> 2.6400000000000148 | E150: 2.6400000000000148 | F150: 40766 | G150: 245.7 | H150: 231.03057142899999 | I150: 230.320363636 | J150: -74.288428330100004 | K150: 277.243714286 | L150: -3.55485714286 | M150: -3.7830303030299999 | N150: FALSE | O150: FALSE | P150: 233.61 | Q150: -0.27835164834999998 | R150: -33.45 | S150: 235.11 | T150: 240.813333333 | U150: 248.01666666700001 | V150: TRUE | W150: 252.90333333300001 | X150: TRUE | Y150: 40.829632991499999 | Z150: 235.92666666700001 | AA150: FALSE | AB150: 228.723333333 | AC150: FALSE | AD150: nflx | AE150: 3083374
A151: 33.3070287651 | B151: -4.0137830550100002 | C151: 244 | D151: =C146-C151 -> -2.8899999999999864 | E151: -2.8899999999999864 | F151: 40767 | G151: 247.85 | H151: 232.337142857 | I151: 232.89436363600001 | J151: -71.223463402199997 | K151: 270.57571428599999 | L151: -2.9414285714299999 | M151: -2.7223636363599999 | N151: TRUE | O151: FALSE | P151: 242.07 | Q151: -0.61342857142999996 | R151: -37.53 | S151: 247.04 | T151: 244.64 | U151: 247.21 | V151: FALSE | W151: 250.42 | X151: FALSE | Y151: 41.423237379100001 | Z151: 241.43 | AA151: FALSE | AB151: 238.86 | AC151: FALSE | AD151: nflx | AE151: 2579225
A152: 35.259790039099997 | B152: -4.9256654041400001 | C152: 246.28 | D152: =C147-C152 -> -19.64 | E152: -19.64 | F152: 40770 | G152: 246.78 | H152: 233.213714286 | I152: 236.93345454499999 | J152: -68.812836695900003 | K152: 266.75200000000001 | L152: -2.5798681318700001 | M152: -1.4447878787899999 | N152: FALSE | O152: FALSE | P152: 236.21 | Q152: -0.36156043956 | R152: -20.63 | S152: 245.67 | T152: 243.09 | U152: 249.97 | V152: FALSE | W152: 253.66 | X152: FALSE | Y152: 43.036083587500002 | Z152: 239.4 | AA152: TRUE | AB152: 232.52 | AC152: TRUE | AD152: nflx | AE152: 3313173
A153: 37.058810143899997 | B153: -8.7960465327000001 | C153: 239.04 | D153: =C148-C153 -> -1.2399999999999807 | E153: -1.2399999999999807 | F153: 40771 | G153: 245.34 | H153: 233.17657142900001 | I153: 238.16818181799999 | J153: -66.053909626500001 | K153: 262.44914285700003 | L153: -2.2517362637399998 | M153: -0.76684848484799994 | N153: FALSE | O153: FALSE | P153: 235.9 | Q153: -0.32813186813 | R153: -30.38 | S153: 244.33 | T153: 240.093333333 | U153: 244.28666666699999 | V153: FALSE | W153: 249.533333333 | X153: FALSE | Y153: 39.3326138296 | Z153: 234.84666666699999 | AA153: TRUE | AB153: 230.65333333300001 | AC153: FALSE | AD153: nflx | AE153: 2635300
A154: 38.3764358265 | B154: -25.382980517299998 | C154: 232.24 | D154: =C149-C154 -> 0.1799999999999784 | E154: 0.1799999999999784 | F154: 40772 | G154: 241.08 | H154: 231.85885714299999 | I154: 238.60436363599999 | J154: -64.287202101099993 | K154: 258.855428571 | L154: -2.07665934066 | M154: -5.3030303030299999E-2 | N154: FALSE | O154: FALSE | P154: 228.54 | Q154: -0.17507692308 | R154: -34.38 | S154: 240.61 | T154: 233.95333333299999 | U154: 239.366666667 | V154: FALSE | W154: 246.49333333300001 | X154: FALSE | Y154: 36.183144411400001 | Z154: 226.82666666700001 | AA154: TRUE | AB154: 221.413333333 | AC154: TRUE | AD154: nflx | AE154: 3685456
A155: 38.960399056100002 | B155: -70.675403190599994 | C155: 217.48 | D155: =C150-C155 -> 25.65 | E155: 25.65 | F155: 40773 | G155: 226 | H155: 227.63800000000001 | I155: 232.609818182 | J155: -65.486645300700005 | K155: 256.14628571399999 | L155: -2.19294505495 | M155: -0.75648484848499997 | N155: FALSE | O155: FALSE | P155: 214.98 | Q155: 0.11628571428999999 | R155: -48.51 | S155: 223.4 | T155: 219.48666666700001 | U155: 223.99333333300001 | V155: FALSE | W155: 230.50666666699999 | X155: FALSE | Y155: 30.478370252800001 | Z155: 212.973333333 | AA155: TRUE | AB155: 208.466666667 | AC155: TRUE | AD155: nflx | AE155: 4999468
A156: 39.045780777300003 | B156: -87.598429374899993 | C156: 205.21 | D156: =C151-C156 -> 38.79 | E156: 38.79 | F156: 40774 | G156: 221 | H156: 221.27514285699999 | I156: 222.987636364 | J156: -68.4534772019 | K156: 254.199142857 | L156: -2.5326153846200001 | M156: -2.09696969697 | N156: FALSE | O156: FALSE | P156: 205 | Q156: 0.33967032966999999 | R156: -58.17 | S156: 214.37 | T156: 210.40333333300001 | U156: 215.806666667 | V156: FALSE | W156: 226.40333333300001 | X156: FALSE | Y156: 26.708514195799999 | Z156: 199.806666667 | AA156: TRUE | AB156: 194.40333333300001 | AC156: TRUE | AD156: nflx | AE156: 4696756
A157: 39.047868979299999 | B157: -81.440292242699996 | C157: 205.21 | D157: =C152-C157 -> 41.07 | E157: 41.07 | F157: 40777 | G157: 212.37 | H157: 215.69142857099999 | I157: 212.429636364 | J157: -70.477097865299996 | K157: 252.35571428599999 | L157: -2.82032967033 | M157: -3.9669696969700001 | N157: FALSE | O157: TRUE | P157: 203.35 | Q157: 0.28771428571000002 | R157: -51.99 | S157: 212.37 | T157: 206.97666666699999 | U157: 210.60333333299999 | V157: FALSE | W157: 215.996666667 | X157: FALSE | Y157: 26.708514195799999 | Z157: 201.58333333300001 | AA157: FALSE | AB157: 197.95666666700001 | AC157: FALSE | AD157: nflx | AE157: 4795995
A158: 39.205652601399997 | B158: -43.103067952400004 | C158: 219.54 | D158: =C153-C158 -> 19.5 | E158: 19.50 | F158: 40778 | G158: 219.75 | H158: 215.678 | I158: 210.22290909099999 | J158: -67.190309924100006 | K158: 246.58914285700001 | L158: -2.37778021978 | M158: -4.0515757575800002 | N158: FALSE | O158: FALSE | P158: 204.09 | Q158: -0.44254945055 | R158: -40.46 | S158: 207 | T158: 214.46 | U158: 224.83 | V158: TRUE | W158: 230.12 | X158: TRUE | Y158: 37.2254169598 | Z158: 209.17 | AA158: FALSE | AB158: 198.8 | AC158: FALSE | AD158: nflx | AE158: 4220004
A159: 39.357640596400003 | B159: -32.118994150100001 | C159: 216.03 | D159: =C154-C159 -> 16.21 | E159: 16.21 | F159: 40779 | G159: 220 | H159: 213.88514285700001 | I159: 206.72363636399999 | J159: -66.743107179399999 | K159: 244.133428571 | L159: -2.32679120879 | M159: -4.4649696969699999 | N159: FALSE | O159: FALSE | P159: 209.5 | Q159: -5.098901099E-2 | R159: -29.74 | S159: 219.04 | T159: 215.17666666700001 | U159: 220.85333333299999 | V159: FALSE | W159: 225.67666666700001 | X159: FALSE | Y159: 35.867777630200003 | Z159: 210.35333333299999 | AA159: FALSE | AB159: 204.67666666700001 | AC159: FALSE | AD159: nflx | AE159: 4410610
A160: 39.584366390600003 | B160: -15.2101845858 | C160: 215.83 | D160: =C155-C160 -> 1.6499999999999773 | E160: 1.6499999999999773 | F160: 40780 | G160: 223.71 | H160: 212.22485714300001 | I160: 206.19127272700001 | J160: -66.541609298799997 | K160: 242.18228571399999 | L160: -2.3044175824200002 | M160: -3.97660606061 | N160: TRUE | O160: FALSE | P160: 214.42 | Q160: -2.237362637E-2 | R160: -25.28 | S160: 217.79 | T160: 217.98666666700001 | U160: 221.55333333300001 | V160: TRUE | W160: 227.276666667 | X160: FALSE | Y160: 35.787686204899998 | Z160: 212.26333333299999 | AA160: FALSE | AB160: 208.69666666699999 | AC160: FALSE | AD160: nflx | AE160: 3722911
A161: 39.680303671799997 | B161: -8.7334275320899994 | C161: 221.89 | D161: =C156-C161 -> -16.68 | E161: -16.68 | F161: 40781 | G161: 222.5 | H161: 210.77799999999999 | I161: 209.41545454499999 | J161: -67.997799423100005 | K161: 242.95057142900001 | L161: -2.4748131868100001 | M161: -2.76878787879 | N161: FALSE | O161: TRUE | P161: 212.5 | Q161: 0.17039560439000001 | R161: -4.75 | S161: 214.38 | T161: 218.96333333300001 | U161: 225.42666666700001 | V161: TRUE | W161: 228.96333333300001 | X161: FALSE | Y161: 40.148653142500002 | Z161: 215.42666666700001 | AA161: FALSE | AB161: 208.96333333300001 | AC161: FALSE | AD161: nflx | AE161: 3659762
A162: 39.885448480000001 | B162: -7.7488535070799998 | C162: 225.04 | D162: =C157-C162 -> -19.83 | E162: -19.83 | F162: 40784 | G162: 226.98 | H162: 211.871142857 | I162: 215.389818182 | J162: -65.222352983199997 | K162: 240.03457142900001 | L162: -2.1664175824199998 | M162: -0.96915151515200004 | N162: FALSE | O162: FALSE | P162: 222.25 | Q162: -0.30839560439000002 | R162: -12.76 | S162: 226.97 | T162: 224.75666666699999 | U162: 227.26333333299999 | V162: TRUE | W162: 229.48666666700001 | X162: FALSE | Y162: 42.340732189699999 | Z162: 222.533333333 | AA162: FALSE | AB162: 220.026666667 | AC162: FALSE | AD162: nflx | AE162: 2789467
A163: 40.373623284300002 | B163: 40.379488099900001 | C163: 236.28 | D163: =C158-C163 -> -16.74 | E163: -16.74 | F163: 40785 | G163: 238.81 | H163: 215.45057142900001 | I163: 224.957636364 | J163: -58.906647021799998 | K163: 237.00657142899999 | L163: -1.6581538461500001 | M163: 1.2183636363599999 | N163: FALSE | O163: FALSE | P163: 223.5 | Q163: -0.50826373626999999 | R163: 3.86 | S163: 224.5 | T163: 232.86333333300001 | U163: 242.22666666699999 | V163: TRUE | W163: 248.17333333299999 | X163: TRUE | Y163: 49.454579475999999 | Z163: 226.91666666699999 | AA163: FALSE | AB163: 217.55333333300001 | AC163: FALSE | AD163: nflx | AE163: 4503044
A164: 40.902553965899997 | B164: 62.581090492800001 | C164: 235.01 | D164: =C159-C164 -> -18.98 | E164: -18.98 | F164: 40786 | G164: 241.88 | H164: 220.123142857 | I164: 232.87727272699999 | J164: -40.366729676600002 | K164: 231.17400000000001 | L164: -0.85006593406599995 | M164: 2.9167272727300002 | N164: TRUE | O164: FALSE | P164: 230.89 | Q164: -0.80808791208399999 | R164: -8.12 | S164: 238.93 | T164: 235.92666666700001 | U164: 240.96333333300001 | V164: FALSE | W164: 246.91666666699999 | X164: FALSE | Y164: 48.723116136999998 | Z164: 229.973333333 | AA164: FALSE | AB164: 224.936666667 | AC164: FALSE | AD164: nflx | AE164: 3942690
A165: 41.393703884499999 | B165: 64.5604009555 | C165: 233.27 | D165: =C160-C165 -> -17.44 | E165: -17.44 | F165: 40787 | G165: 238.5 | H165: 224.704571429 | I165: 237.09272727300001 | J165: -1.56485592948 | K165: 225.059714286 | L165: -2.7318681318700001E-2 | M165: 3.5026060606099998 | N165: FALSE | O165: FALSE | P165: 232.53 | Q165: -0.822747252747 | R165: -10.73 | S165: 234.53 | T165: 234.76666666700001 | U165: 237.003333333 | V165: FALSE | W165: 240.73666666700001 | X165: FALSE | Y165: 47.682535823800002 | Z165: 231.033333333 | AA165: FALSE | AB165: 228.79666666700001 | AC165: FALSE | AD165: nflx | AE165: 3012199
A166: 40.249725425900003 | B166: -53.885808128800001 | C166: 218.77 | D166: =C161-C166 -> 3.1199999999999761 | E166: 3.1199999999999761 | F166: 40792 | G166: 218.95 | H166: 226.189714286 | I166: 232.98381818199999 | J166: 26.723998923300002 | K166: 219.644571429 | L166: 0.50347252747299998 | M166: 2.28818181818 | N166: FALSE | O166: TRUE | P166: 208.73 | Q166: -0.53079120879200004 | R166: -27.51 | S166: 209.1 | T166: 215.48333333299999 | U166: 222.23666666700001 | V166: FALSE | W166: 225.70333333299999 | X166: FALSE | Y166: 40.013355358699997 | Z166: 212.01666666700001 | AA166: TRUE | AB166: 205.26333333299999 | AC166: TRUE | AD166: nflx | AE166: 4023394
A167: 39.295978466999998 | B167: -37.141049428800002 | C167: 216 | D167: =C162-C167 -> 9.039999999999992 | E167: 9.039999999999992 | F167: 40793 | G167: 221.98 | H167: 226.714285714 | I167: 227.178363636 | J167: 39.941547875700003 | K167: 215.82857142899999 | L167: 0.83736263736299998 | M167: 0.75830303030299995 | N167: TRUE | O167: FALSE | P167: 212.56 | Q167: -0.33389010989000001 | R167: -23.04 | S167: 221.49 | T167: 216.84666666699999 | U167: 221.133333333 | V167: FALSE | W167: 226.26666666700001 | X167: FALSE | Y167: 38.731753230199999 | Z167: 211.71333333300001 | AA167: FALSE | AB167: 207.42666666700001 | AC167: FALSE | AD167: nflx | AE167: 4249749
A168: 38.233505254100002 | B168: -62.361553192000002 | C168: 211.2 | D168: =C163-C168 -> 25.08 | E168: 25.08 | F168: 40794 | G168: 218.75 | H168: 225.69142857099999 | I168: 221.99218181800001 | J168: 42.340057161600001 | K168: 213.845714286 | L168: 0.911208791209 | M168: -0.208848484848 | N168: FALSE | O168: FALSE | P168: 209.81 | Q168: -7.3846153846000004E-2 | R168: -21.04 | S168: 214.06 | T168: 213.253333333 | U168: 216.69666666699999 | V168: FALSE | W168: 222.193333333 | X168: FALSE | Y168: 36.547267023099998 | Z168: 207.75666666699999 | AA168: TRUE | AB168: 204.313333333 | AC168: FALSE | AD168: nflx | AE168: 3943925
A169: 36.819034686199998 | B169: -109.916252883 | C169: 203.97 | D169: =C164-C169 -> 31.04 | E169: 31.04 | F169: 40795 | G169: 212.1 | H169: 221.30199999999999 | I169: 214.06127272699999 | J169: 21.0254433375 | K169: 216.30514285699999 | L169: 0.38437362637400002 | M169: -1.7032727272699999 | N169: FALSE | O169: FALSE | P169: 203.19 | Q169: 0.52683516483500004 | R169: -13.51 | S169: 210.22 | T169: 206.42 | U169: 209.65 | V169: FALSE | W169: 215.33 | X169: FALSE | Y169: 33.483894200999998 | Z169: 200.74 | AA169: TRUE | AB169: 197.51 | AC169: TRUE | AD169: nflx | AE169: 4554601